J,"Sanga, SK; Ansryan, LZ",,,"Sanga, Shavinderpal K.; Ansryan, Lianna Z.",Early identification and delirium recognition in acute care: A quality improvement initiative,GERIATRIC NURSING,,English,Article,,,,,,Delirium; Early identification; Confusion assessment method (CAM); Geriatric nurse champions (GNCS); Geriatric clinical nurse specialist (GCNS) quality improvement (QI),NURSES; DIAGNOSIS; ADULTS,"Recognition of delirium continues to be a challenge in acute care despite the use of validated and reliable tools. This evidence-based quality improvement project aimed to increase delirium recognition by increasing daily screening using the Confusion Assessment Method (CAM) tool. Methods to increase usage and accuracy of the assessment included targeted education by specially trained geriatric nurse champions (GNCs). During rounds, GNCs performed bedside assessment, provided real-time feedback, and focused on non-pharmacological interventions on medical-surgical and telemetry units. All patients 65 years of age and older were included. Daily screening of CAM assessment increased by 7.6 % over three months, including an increase in CAM positive results from 7.1 % to 8.5 %-additional favorable outcomes observed with an increase in delirium diagnosis. This project increased knowledge retention and reinforcement of non-pharmacological interventions through peer coaching and focused rounds. Continued training efforts and education are needed to increase identification of patients experiencing delirium. (c) 2025 Elsevier Inc. All rights are reserved, including those for text and data mining, AI training, and similar technologies.","[Sanga, Shavinderpal K.] Kaiser Permanente South Sacramento Med Ctr, Sacramento, CA 95823 USA; [Ansryan, Lianna Z.] Univ Calif Los Angeles Hlth, Ronal Reagon Campus, Los Angeles, CA USA",Kaiser Permanente; University of California System; University of California Los Angeles,"Sanga, SK (corresponding author), Kaiser Permanente South Sacramento Med Ctr, Sacramento, CA 95823 USA.",Shavinderpal.K.Sanga@kp.org,,"Ansryan, Lianna/0009-0005-8462-7074",DAISY Health Equity Grant,DAISY Health Equity Grant,Author wants to recognize DAISY Foundation for their support by providing DAISY Health Equity Grant.,19,0,1,1,2,MOSBY-ELSEVIER,NEW YORK,"360 PARK AVENUE SOUTH, NEW YORK, NY 10010-1710 USA",0197-4572,1528-3984,,GERIATR NURS,Geriatr. Nurs.,MAY-JUN,2025,63.0,,,,,630,634,,10.1016/j.gerinurse.2025.04.013,http://dx.doi.org/10.1016/j.gerinurse.2025.04.013,MAY 2025,5,Geriatrics & Gerontology; Gerontology; Nursing,Science Citation Index Expanded (SCI-EXPANDED); Social Science Citation Index (SSCI),Geriatrics & Gerontology; Nursing,2TN7L,40349626.0,,2026-03-01,WOS:001490966500006,View Full Record in Web of Science
J,"Tong, CY; Ren, CH",,,"Tong, Chunyan; Ren, Changhong",Deep knowledge tracing and cognitive load estimation for personalized learning path generation using neural network architecture,SCIENTIFIC REPORTS,,English,Article,,,,,,Deep knowledge tracing; Cognitive load Estimation; Personalized learning; Neural networks; Adaptive learning systems; Educational technology,,"This paper presents a novel approach for personalized learning path generation by integrating deep knowledge tracing and cognitive load estimation within a unified framework. We propose a dual-stream neural network architecture that simultaneously models students' knowledge states and cognitive load levels to optimize learning trajectories. The knowledge state tracking module employs a bidirectional Transformer with graph attention mechanisms to capture complex relationships between knowledge components, while the cognitive load estimation module utilizes multimodal data analysis to dynamically assess mental effort during learning activities. A dual-objective optimization algorithm balances knowledge acquisition with cognitive load management to generate paths that maintain optimal challenge levels. Experimental evaluations across multiple educational domains demonstrate that our approach outperforms existing methods in prediction accuracy (87.5%), path quality (4.4/5), and learning efficiency (24.6% improvement). The implemented system supports real-time adaptation based on performance and cognitive state, resulting in reduced frustration, higher engagement, and improved knowledge retention. This research contributes to both theoretical understanding of learning processes and practical implementation of next-generation adaptive educational technologies.","[Tong, Chunyan] Chongqing Coll Int Business & Econ, Acad Affairs Off, Chongqing 401520, Peoples R China; [Ren, Changhong] Chongqing Coll Int Business & Econ, Informat Technol Ctr, Chongqing 401520, Peoples R China",,"Ren, CH (corresponding author), Chongqing Coll Int Business & Econ, Informat Technol Ctr, Chongqing 401520, Peoples R China.",ren_ch@163.com,,,,,,64,3,4,19,21,NATURE PORTFOLIO,BERLIN,"HEIDELBERGER PLATZ 3, BERLIN, 14197, GERMANY",2045-2322,,,SCI REP-UK,Sci Rep,JUL 10,2025,15.0,1,,,,,,24925,10.1038/s41598-025-10497-x,http://dx.doi.org/10.1038/s41598-025-10497-x,,14,Multidisciplinary Sciences,Science Citation Index Expanded (SCI-EXPANDED),Science & Technology - Other Topics,4UO0G,40640459.0,"Green Submitted, gold",2026-03-01,WOS:001527008100040,View Full Record in Web of Science
J,"Barrett, A; Zhang, ND; Wei, SY",,,"Barrett, Alex; Zhang, Nuodi; Wei, Shiyao",The Virtual Reality in Your Head: How Immersion and Mental Imagery Are Connected to Knowledge Retention,EDUCATIONAL PSYCHOLOGY REVIEW,,English,Article,,,,,,Immersive learning; Immersion; Mental imagery; Memory recall; Cognitive load; Narratives,TECHNOLOGY; ILLUSTRATIONS; COMPREHENSION; EDUCATION; TEXT,"Immersive learning is predominantly constrained to technology-based interventions but has the potential for more diverse applications. This study reports on an experiment investigating the learning affordances of psychological immersion evoked by narrative absorption. A total of 228 participants were randomly assigned to one of three forms of media, an image, a word list, and a narrative, all of which contained identical items to be memorized for immediate and delayed free recall memory tests. Other variables measured were immersion, extraneous cognitive load, and mental imagery. ANOVA and correlation analyses showed that the narrative media was found to be significantly more immersive and that it evoked mental imagery in individuals at higher levels than both the list and image media. Importantly, there was more decay in memory recall between immediate and delayed tests for those exposed to the list and the image than for those who read the narrative. This implies the utility of immersive narratives for spontaneous mental image generation, which leads to improved knowledge retention. Other implications for immersive learning theory are discussed, and practical solutions for incorporating narrative immersion in learning are also suggested.","[Barrett, Alex; Zhang, Nuodi; Wei, Shiyao] Florida State Univ, Coll Educ Hlth & Human Sci, Stone Bldg,1114 W Call St, Tallahassee, FL 32306 USA",State University System of Florida; Florida State University,"Barrett, A (corresponding author), Florida State Univ, Coll Educ Hlth & Human Sci, Stone Bldg,1114 W Call St, Tallahassee, FL 32306 USA.",abarrett3@fsu.edu; nzhang4@fsu.edu; sw22b@fsu.edu,"; Barrett, Alex/AAC-7531-2021; Zhang, Nuodi/LSK-7365-2024","Wei, Shiyao/0000-0002-0844-0372; Barrett, Alex/0000-0003-1229-9743; Zhang, Nuodi/0000-0003-0761-2176",,,,91,0,1,6,23,SPRINGER/PLENUM PUBLISHERS,NEW YORK,"233 SPRING ST, NEW YORK, NY 10013 USA",1040-726X,1573-336X,,EDUC PSYCHOL REV,Educ. Psychol. Rev.,JAN 24,2025,37.0,1,,,,,,9,10.1007/s10648-025-09984-4,http://dx.doi.org/10.1007/s10648-025-09984-4,,29,"Psychology, Educational",Social Science Citation Index (SSCI),Psychology,T4V6F,,,2026-03-01,WOS:001405003800001,View Full Record in Web of Science
J,"Sporn, K; Kumar, R; Paladugu, P; Ong, J; Sekhar, T; Vaja, S; Hage, T; Waisberg, E; Gowda, C; Jagadeesan, R; Zaman, N; Tavakkoli, A",,,"Sporn, Kyle; Kumar, Rahul; Paladugu, Phani; Ong, Joshua; Sekhar, Tejas; Vaja, Swapna; Hage, Tamer; Waisberg, Ethan; Gowda, Chirag; Jagadeesan, Ram; Zaman, Nasif; Tavakkoli, Alireza",Artificial Intelligence in Orthopedic Medical Education: A Comprehensive Review of Emerging Technologies and Their Applications,INTERNATIONAL MEDICAL EDUCATION,,English,Review,,,,,,AI and MR in orthopedic education; AI-powered platforms; personalized learning; preoperative planning; evidence-based practices,MIXED REALITY TECHNOLOGY; VIRTUAL-REALITY,"Integrating artificial intelligence (AI) and mixed reality (MR) into orthopedic education has transformed learning. This review examines AI-powered platforms like Microsoft HoloLens, Apple Vision Pro, and HTC Vive Pro, which enhance anatomical visualization, surgical simulation, and clinical decision-making. These technologies improve the spatial understanding of musculoskeletal structures, refine procedural skills with haptic feedback, and personalize learning through AI-driven adaptive algorithms. Generative AI tools like ChatGPT further support knowledge retention and provide evidence-based insights on orthopedic topics. AI-enabled platforms and generative AI tools help address challenges in standardizing orthopedic education. However, we still face many barriers that relate to standardizing data, algorithm evaluation, ethics, and the curriculum. AI is used in preoperative planning and predictive analytics in the postoperative period that bridges theory and practice. AI and MR are key to supporting innovation and scalability in orthopedic education. However, technological innovation relies on collaborative partnerships to develop equitable, evidence-informed practices that can be implemented in orthopedic education. For sustained impact, innovation must be aligned with pedagogical theories and principles. We believe that orthopedic medical educators' future critical role will be to enhance the next generation of competent clinicians.","[Sporn, Kyle] SUNY Upstate Med Univ, Norton Coll Med, Dept Med, Syracuse, NY 13210 USA; [Kumar, Rahul; Gowda, Chirag] Univ Miami, Miller Sch Med, Dept Biochem & Mol Biol, Miami, FL 33136 USA; [Kumar, Rahul; Sekhar, Tejas; Vaja, Swapna] Rush Med Coll, Chicago, IL 60007 USA; [Paladugu, Phani] Thomas Jefferson Univ, Sidney Kimmel Med Coll, Philadelphia, PA 19107 USA; [Paladugu, Phani] Harvard Med Sch, Brigham & Womens Hosp, Boston, MA 02115 USA; [Ong, Joshua] Univ Michigan, Kellogg Eye Ctr, Dept Ophthalmol & Visual Sci, Ann Arbor, MI 48103 USA; [Hage, Tamer] Virigina Tech, Blacksburg, VA 24061 USA; [Waisberg, Ethan] Univ Cambridge, Dept Clin Neurosci, Cambridge CB2 3EH, England; [Jagadeesan, Ram] Johns Hopkins Univ, Whiting Sch Engn, Dept Comp Sci, Baltimore, MD 21201 USA; [Jagadeesan, Ram] Cisco Syst Inc, Artificial Intelligence Syst, San Jose, CA 94088 USA; [Zaman, Nasif] Smith Kettlewell Eye Res Inst, San Francisco, CA 94016 USA; [Zaman, Nasif; Tavakkoli, Alireza] Univ Nevada, Dept Comp Sci & Engn, Human Machine Percept Lab, Reno, NV 89557 USA",State University of New York (SUNY) System; SUNY Upstate Medical University; University of Miami; Rush University; Thomas Jefferson University; Harvard University; Harvard University Medical Affiliates; Brigham & Women's Hospital; Harvard Medical School; University of Michigan System; University of Michigan; University of Cambridge; Johns Hopkins University; Cisco Systems Inc; Cisco USA; The Smith-Kettlewell Eye Research Institute; Nevada System of Higher Education (NSHE); University of Nevada Reno,"Sekhar, T (corresponding author), Rush Med Coll, Chicago, IL 60007 USA.",spornk@upstate.edu; rxk641@miami.edu; phani.paladugu@students.jefferson.edu; ongjo@med.umich.edu; tejas_sekhar@rush.edu; swanpna_vaja@rush.edu; tamerwh@gmail.com; cambridgemlgroup@gmail.com; gowdachirag24@gmail.com; ramjagad@cisco.com; zaman@nevada.unr.edu; tavakkol@unr.edu,"; Tavakkoli, Alireza/AAL-7053-2021; Zaman, Nasif/IWE-1449-2023",", Rahul Kumar/0000-0001-8574-2895; Sporn, Kyle/0009-0005-5707-9009;",,,,56,0,0,2,2,MDPI,BASEL,"MDPI AG, Grosspeteranlage 5, CH-4052 BASEL, SWITZERLAND",,2813-141X,,INT MED EDUC,Int. Med. Educ.,APR 30,2025,4.0,2,,,,,,14,10.3390/ime4020014,http://dx.doi.org/10.3390/ime4020014,,21,"Education, Scientific Disciplines",Emerging Sources Citation Index (ESCI),Education & Educational Research,D5617,,"Green Submitted, gold",2026-03-01,WOS:001621656000001,View Full Record in Web of Science
C,"De Vito, G; D'Amici, D; Izzo, F; Ferrucci, F; Di Nucci, D",,IEEE,"De Vito, Gabriele; D'Amici, Damiano; Izzo, Fabiano; Ferrucci, Filomena; Di Nucci, Dario",LLM-based Generation of Solidity Smart Contracts from System Requirements in Natural Language: the AstraKode Case,"2025 IEEE INTERNATIONAL CONFERENCE ON SOFTWARE ANALYSIS, EVOLUTION AND REENGINEERING, SANER",IEEE International Conference on Software Analysis Evolution and Reengineering,English,Proceedings Paper,2025 International Conference on Software Analysis Evolution and Reengineering-SANER-Annual,"MAR 04-07, 2025","Montreal, CANADA",,,Smart Contracts; No-Code Platform; Code Generation; Large Language Model,,"As blockchain technology continues to evolve, the need for accessible solutions for developing smart contracts has grown, especially for non-technical users. This paper addresses practitioners' challenges in generating Solidity smart contracts from natural language requirements within the AstraKode Blockchain no-code platform (AKB). Our goal is to lower the barrier of entry into smart contract development, making it more accessible to users with limited technical expertise. We propose three methods, i.e., Naive Generation, Augmented Generation, and Enhanced Generation, each utilizing large language models to streamline the code generation process. These methods cater to different user needs, from rapid prototyping to handling complex business scenarios, improving accessibility and usability within AKB. We demonstrate their practical relevance, potential, and limitations in addressing real-world challenges in smart contract development through empirical evaluations and practitioner feedback. Thanks to collaboration with academia and effective knowledge transfer, these methods provide innovative solutions to the challenges of smart contract generation. Furthermore, they have been integrated into AKB to enhance user services, ultimately promoting the development and deployment of secure and efficient smart contracts in the industry.","[De Vito, Gabriele; Ferrucci, Filomena; Di Nucci, Dario] Univ Salerno, Software Engn SeSa Lab, Salerno, Italy; [D'Amici, Damiano; Izzo, Fabiano] AstraKode Srl, Pescara, Italy",University of Salerno,"De Vito, G (corresponding author), Univ Salerno, Software Engn SeSa Lab, Salerno, Italy.",gadevito@unisa.it; damiano.damici@astrakode.tech; fabiano.izzo@astrakode.tech; fferrucci@unisa.it; ddinucci@unisa.it,"Di Nucci, Dario/Y-9679-2019; De Vito, Gabriele/AEX-3144-2022; Ferrucci, Filomena/AAG-6799-2020","D'Amici, Damiano/0009-0002-0044-1810",,,,34,0,0,1,1,IEEE COMPUTER SOC,LOS ALAMITOS,"10662 LOS VAQUEROS CIRCLE, PO BOX 3014, LOS ALAMITOS, CA 90720-1264 USA",1534-5351,,979-8-3315-3510-0,Soft Anal Evol Reeng,,,2025,,,,,,170,180,,10.1109/SANER64311.2025.00024,http://dx.doi.org/10.1109/SANER64311.2025.00024,,11,"Computer Science, Interdisciplinary Applications; Computer Science, Software Engineering; Computer Science, Theory & Methods",Conference Proceedings Citation Index - Science (CPCI-S),Computer Science,BY8XR,,,2026-03-01,WOS:001506888600016,View Full Record in Web of Science
J,"Biron, M; Turgeman-Lupo, K; Zaid-Dominik, O",,,"Biron, Michal; Turgeman-Lupo, Keren; Zaid-Dominik, Orna",Contextualizing the usefulness of knowledge received from retiring employees: leader behaviour and organisational culture,KNOWLEDGE MANAGEMENT RESEARCH & PRACTICE,,English,Article,,,,,,Innovation culture; knowledge continuity; knowledge usefulness; retiree knowledge retention; transformational leadership,TRANSFORMATIONAL LEADERSHIP; TACIT KNOWLEDGE; MANAGEMENT; SUBSTITUTES; RETENTION; INDUSTRY; IMPACT,"Knowledge loss is increasingly at the centre of business agendas, as large numbers of baby boomers are retiring, and employees of diverse age cohorts are resigning amid workforce shifts triggered by the COVID-19 pandemic. This research explores how specific contextual factors, namely transformational leadership and innovation culture, contribute to the relationship between retiring employees' knowledge continuity (KC) behaviour and the extent to which imparted knowledge is useful to recipients' performance post-departure. We analysed survey data from 81 triads of knowledge workers at a technology-intensive firm - matched data from retiring employees, their supervisors, and their successors. Surveys were administered both before and after retirees' departure. We find a positive association between KC behaviour and the usefulness of the knowledge received, mostly when supervisors are perceived as more transformational. When supervisors are perceived as less transformational, this association is attenuated to the point of non-significance, particularly under perceptions of low innovation culture.","[Biron, Michal; Zaid-Dominik, Orna] Univ Haifa, Fac Social Sci, Sch Business Adm, Har Hakarmel, Israel; [Turgeman-Lupo, Keren] Univ Haifa, Ramat Gan Acad Coll, Ctr study Org & Human Resource Management, Management & Human Resources Program, Ramat Gan, Israel; [Biron, Michal] Univ Haifa, Fac Social Sci, Sch Business Adm, IL-3498838 Haifa, Israel",University of Haifa; University of Haifa; Ramat Gan Academic College; University of Haifa,"Biron, M (corresponding author), Univ Haifa, Fac Social Sci, Sch Business Adm, IL-3498838 Haifa, Israel.",mbiron@univ.haifa.ac.il,"Turgeman-Lupo, Keren/PBU-6735-2025; Biron, Michal/HPG-8347-2023","Biron, Michal/0000-0002-3364-2566; Turgeman-Lupo, Keren/0000-0003-0636-3390",Ramat-Gan Academic College,Ramat-Gan Academic College,The authors wish to acknowledge Ramat-Gan Academic College for their support.,59,1,1,1,20,TAYLOR & FRANCIS LTD,ABINGDON,"2-4 PARK SQUARE, MILTON PARK, ABINGDON OR14 4RN, OXON, ENGLAND",1477-8238,1477-8246,,KNOWL MAN RES PRACT,Knowl. Manag. Res. Pract.,NOV 1,2024,22.0,6,,,,620,631,,10.1080/14778238.2023.2297060,http://dx.doi.org/10.1080/14778238.2023.2297060,DEC 2023,12,Information Science & Library Science; Management,Social Science Citation Index (SSCI),Information Science & Library Science; Business & Economics,U7Y4V,,,2026-03-01,WOS:001128363200001,View Full Record in Web of Science
J,"Ramos-Zuñiga, R; de Chavez, MHR; Santillán-Doherty, PJ; Sánchez-Mendiola, M; Gutiérrez-Cirlos, C; Carrillo-Esper, R",,,"Ramos-Zuniga, Rodrigo; de Chavez, Manuel H. Ruiz; Santillan-Doherty, Patricio J.; Sanchez-Mendiola, Melchor; Gutierrez-Cirlos, Carlos; Carrillo-Esper, Raul",Recommendations of the National Academy of Medicine of Mexico in the face of artificial intelligence in the biomedical scenario,GACETA MEDICA DE MEXICO,,Spanish,Article,,,,,,Algorithm; Bioethics; Cyber medicine; Artificial intelligence; Digital health,ARTIFICIAL-INTELLIGENCE,"Artificial intelligence as a generic concept is present in all activities of daily life in contemporary society. In the biomedical scenario has had a particular presence, with the development of systems ranging from the generation of knowledge in medical research to applications in different areas of individual and collective health. Such is the case of new tools based AI in different modalities, in public health, diagnostics, image, medical and surgical clinical processes, as well as rehabilitation, inclusion and functional facilitation strategies. Despite being a relevant advance based on technological innovation and knowledge transfer for management and decision making, it is pertinent to consider some reasonable precautionary measures as recommendations, to evaluate in a timely manner, the safety, efficacy and risks.","[Ramos-Zuniga, Rodrigo] Univ Guadalajara, Ctr Univ Ciencias Salud, Dept Neurociencias, Guadalajara, Jalisco, Mexico; [Ramos-Zuniga, Rodrigo] Comision Estatal Bioet Jalisco SSJ, Guadalajara, Jalisco, Mexico; [de Chavez, Manuel H. Ruiz] Hosp Med Sur, Acad Nacl Med Mexico, Mexico City, Mexico; [Santillan-Doherty, Patricio J.] Comision Nacl Bioet, Mexico City, Mexico; [Sanchez-Mendiola, Melchor] Univ Nacl Autonoma Mexico, Fac Med, Div Estudios Posgrad, Mexico City, Mexico; [Gutierrez-Cirlos, Carlos] Univ Nacl Autonoma Mexico, Fac Med, Mexico City, Mexico; [Gutierrez-Cirlos, Carlos] Inst Nacl Ciencias Med Nutr Salvador Zubiran y, Serv Med Interna, Direcc Med, Mexico City, Mexico; [Carrillo-Esper, Raul] Presidencia Acad Nacl Med Mexico, Mexico City, Mexico",Universidad de Guadalajara; Universidad Nacional Autonoma de Mexico; Universidad Nacional Autonoma de Mexico,"Carrillo-Esper, R (corresponding author), Presidencia Acad Nacl Med Mexico, Mexico City, Mexico.",raulcarrilloesper@gmail.com,"Sanchez-Mendiola, Melchor/GRJ-1539-2022; Ramos, Rodrigo/KPB-4949-2024; Gutiérrez-Cirlos, Carlos/AAR-7999-2021",,,,,30,0,0,1,1,ACAD NACIONAL MEDICINA MEXICO,MEXICO,"CENTRO MEDICO NACIONAL SIGLO XXI, UNIDAD CONGRESOS, GLOQUE B, PROMER PISO, MEXICO, DF 06725, MEXICO",0016-3813,,,GAC MED MEX,Gac. Med. Mex.,MAY-JUN,2025,161.0,3,,,,,,,10.24875/GMM.24000408,http://dx.doi.org/10.24875/GMM.24000408,,8,"Medicine, General & Internal",Science Citation Index Expanded (SCI-EXPANDED),General & Internal Medicine,AJ5FG,,"Green Submitted, gold",2026-03-01,WOS:001649614000002,View Full Record in Web of Science
J,"Drozdova, A; Polokova, K; Jiravsky, O; Godula, BJ; Chovancik, J; Ranic, I; Jiravsky, F; Hecko, J; Sknouril, L",,,"Drozdova, Adela; Polokova, Karin; Jiravsky, Otakar; Godula, Bogna Jiravska; Chovancik, Jan; Ranic, Ivan; Jiravsky, Filip; Hecko, Jan; Sknouril, Libor",Comparing Conventional Physician-Led Education with VR Education for Pacemaker Implantation: A Randomized Study,HEALTHCARE,,English,Article,,,,,,patient education; virtual reality; pacemaker implantation; medical technology in education; health outcomes; preoperative anxiety,VIRTUAL-REALITY; ANXIETY,"Introduction: Education of patients prior to an invasive procedure is pivotal for good cooperation and knowledge retention. Virtual reality (VR) is a fast-developing technology that helps educate both medical professionals and patients. Objective: To prove non-inferiority of VR education compared to conventional education in patients prior to the implantation of a permanent pacemaker (PPM). Methods: 150 participants scheduled for an elective implantation of a PPM were enrolled in this prospective study and randomized into two groups: the VR group (n = 75) watched a 360 degrees video about the procedure using the VR headset Oculus Meta Quest 2, while the conventional group (n = 75) was educated by a physician. Both groups filled out a questionnaire to assess the quality of education pre- and in-hospital, their knowledge of the procedure, and their subjective satisfaction. Results: There was no significant difference in the quality of education. There was a non-significant trend towards higher educational scores in the VR group. The subgroup with worse scores was older than the groups with higher scores (82 vs. 76 years, p = 0.025). Anxiety was reduced in 92% of participants. Conclusion: VR proved to be non-inferior to conventional education. It helped to reduce anxiety and showed no adverse effects.","[Drozdova, Adela; Polokova, Karin; Jiravsky, Otakar; Godula, Bogna Jiravska; Chovancik, Jan; Ranic, Ivan; Jiravsky, Filip; Hecko, Jan; Sknouril, Libor] Agel Hosp Trinec Podlesi, Dept Cardiol, Trinec 73961, Czech Republic; [Jiravsky, Otakar] Masaryk Univ, Fac Med, Brno 60177, Czech Republic; [Godula, Bogna Jiravska] Palacky Univ, Fac Med, Olomouc 77900, Czech Republic; [Ranic, Ivan] Univ Ostrava, Fac Med, Ostrava, Czech Republic; [Jiravsky, Filip] Masaryk Univ, Philosoph Fac, Brno 60177, Czech Republic; [Hecko, Jan] VSB Tech Univ Ostrava, Fac Elect Engn & Comp Sci, Ostrava 70800, Czech Republic",Masaryk University; Palacky University Olomouc; University of Ostrava; Masaryk University; Technical University of Ostrava,"Jiravsky, O (corresponding author), Agel Hosp Trinec Podlesi, Dept Cardiol, Trinec 73961, Czech Republic.;Jiravsky, O (corresponding author), Masaryk Univ, Fac Med, Brno 60177, Czech Republic.",otakar.jiravsky@npo.agel.cz,,"ozdová, Adéla/0009-0001-6601-7820; Sknouril, Libor/0000-0001-9190-2007; Jiravsky, Otakar/0000-0001-9334-5734; Hečko, Jan/0000-0003-2514-2059",Educational and Research Institute AGEL o.p.s.,Educational and Research Institute AGEL o.p.s.,"We would like to express our sincere gratitude to all the medical staff who provided their expertise and care during our study. Special recognition is due to Martina Majakova and Barbora Frolova, whose exceptional support and dedication played a pivotal role in facilitating our research. Their commitment went above and beyond and did not go unnoticed. The success of this study reflects the collective efforts and tireless contributions of these individuals and the entire medical staff involved.",26,3,4,4,16,MDPI,BASEL,"ST ALBAN-ANLAGE 66, CH-4052 BASEL, SWITZERLAND",,2227-9032,,HEALTHCARE-BASEL,Healthcare,MAY,2024,12.0,10,,,,,,976,10.3390/healthcare12100976,http://dx.doi.org/10.3390/healthcare12100976,,10,Health Care Sciences & Services; Health Policy & Services,Science Citation Index Expanded (SCI-EXPANDED); Social Science Citation Index (SSCI),Health Care Sciences & Services,SC6M5,38786387.0,"Green Submitted, gold",2026-03-01,WOS:001232298700001,View Full Record in Web of Science
