Publication Type,Authors,Book Editors,Book Group Authors,Author Full Names,Article Title,Source Title,Book Series Title,Language,Document Type,Conference Title,Conference Date,Conference Location,Conference Sponsor,Conference Host,Author Keywords,Keywords Plus,Abstract,Addresses,Affiliations,Reprint Addresses,Email Addresses,Researcher Ids,ORCIDs,Funding Orgs,Funding Name Preferred,Funding Text,Cited Reference Count,"Times Cited, WoS Core","Times Cited, All Databases",180 Day Usage Count,Since 2013 Usage Count,Publisher,Publisher City,Publisher Address,ISSN,eISSN,ISBN,Journal Abbreviation,Journal ISO Abbreviation,Publication Date,Publication Year,Volume,Issue,Part Number,Supplement,Special Issue,Start Page,End Page,Article Number,DOI,DOI Link,Early Access Date,Number of Pages,WoS Categories,Web of Science Index,Research Areas,IDS Number,Pubmed Id,Open Access Designations,Date of Export,UT (Unique WOS ID),Web of Science Record
C,"Riessenberger, KA; Hüsler, SS; Bruggmann, A; Eicher, S; Stulens, L; Misoch, S","Ziefle, M; Mulvenna, M; Maciaszek, L",,"Riessenberger, Katja Antonia; Husler, Samira-Salome; Bruggmann, Anja; Eicher, Simone; Stulens, Leen; Misoch, Sabina",WisdomOfAge: Developing a Seniors Digital Platform for Knowledge Transfer through Participatory Design,ICT4AWE: PROCEEDINGS OF THE 8TH INTERNATIONAL CONFERENCE ON INFORMATION AND COMMUNICATION TECHNOLOGIES FOR AGEING WELL AND E-HEALTH,,English,Proceedings Paper,8th International Conference on Information and Communication Technologies for Ageing Well and e-Health (ICT4AWE),"APR 23-25, 2022",ELECTR NETWORK,INSTICC,,Active Aging; Aging Population; Aging Well; Individualization of Retirement Process; Adaptation of the Labor Market; Social Inclusion; Digital Divide,,"Wisdom Of Age is a platform for knowledge transfer connecting retirees with experience in technological fields with industrial companies. The goal is to establish a mentor-mentee relationship between both parties. Companies will benefit from vast practical experience of seniors and the seniors from an opportunity to actively participate in their former field of work with a workload as high as they choose. This possibility promotes an individualized approach to retirement, active aging, and awareness of the work experience of (soon to be) retirees. Since the project is developed in close cooperation with older people, it also fosters inclusiveness within the technological development process.","[Riessenberger, Katja Antonia; Husler, Samira-Salome; Bruggmann, Anja; Eicher, Simone; Misoch, Sabina] OST Eastern Switzerland Univ Appl Sci, Inst Ageing Res IAF, Rosenbergstr 59, St Gallen, Switzerland; [Stulens, Leen] in4care Happy Aging, Interleuvenlaan 10, Leuven, Belgium",,"Stulens, L (corresponding author), in4care Happy Aging, Interleuvenlaan 10, Leuven, Belgium.",leen.stulens@in4care.be,,"Misoch, Sabina/0000-0003-0791-4991; Eicher, Simone/0000-0001-7655-0592",AAL program; European Commission; National Funding Authority of Romania; National Funding Authority of Switzerland; National Funding Authority of Belgium,AAL program; European Commission(European Union (EU)European Commission Joint Research Centre); National Funding Authority of Romania; National Funding Authority of Switzerland; National Funding Authority of Belgium,"WisdomOfAge is a project supported by the AAL program, co-funded by the European Commission and National Funding Authorities of Romania, Switzerland, and Belgium.",38,0,0,0,7,SCITEPRESS,SETUBAL,"AV D MANUELL, 27A 2 ESQ, SETUBAL, 2910-595, PORTUGAL",,,978-989-758-566-1,,,,2022,,,,,,261,267,,10.5220/0011064200003188,http://dx.doi.org/10.5220/0011064200003188,,7,"Computer Science, Interdisciplinary Applications; Geriatrics & Gerontology",Conference Proceedings Citation Index - Science (CPCI-S),Computer Science; Geriatrics & Gerontology,BT2WJ,,gold,2026-03-01,WOS:000814756600027,View Full Record in Web of Science
J,"Marcus, J; Scheibe, S; Kooij, D; Truxillo, DM; Zaniboni, S; Abuladze, L; Al Mursi, N; Bamberger, PA; Balytska, M; Betanzos, ND; Perek-Bialas, J; Boehm, SA; Burmeister, A; Cabib, I; Caon, M; Deller, J; Derous, E; Drury, L; Eppler-Hattab, R; Fasbender, U; Fülöp, M; Furunes, T; Gerpott, FH; Gostautaite, B; Halvorsen, CJ; Hernaus, T; Inceoglu, I; Iskifoglu, M; Ivanoska, KS; Kanfer, R; Kenig, N; Kiran, S; Klimek, S; Kunze, F; Mertan, EB; Varianou-Mikellidou, C; Moasa, H; Ng, YL; Parker, SK; Reh, S; Resuli, V; Schmeink, M; Silberg, S; Sousa, IC; Steiner, DD; Stukalina, Y; Tomas, J; Topa, G; Turek, K; Vignoli, M; von Bonsdorff, M; Wang, DH; Wang, M; Yeung, DYL; Yildirim, K; Zhang, X; Znidarsic, J",,,"Marcus, Justin; Scheibe, Susanne; Kooij, Dorien; Truxillo, Donald M.; Zaniboni, Sara; Abuladze, Liili; Al Mursi, Noura; Bamberger, Peter A.; Balytska, Mariia; Betanzos, Norma D.; Perek-Bialas, Jolanta; Boehm, Stephan Alexander; Burmeister, Anne; Cabib, Ignacio; Caon, Maurizio; Deller, Juergen; Derous, Eva; Drury, Lisbeth; Eppler-Hattab, Raphael; Fasbender, Ulrike; Fueloep, Marta; Furunes, Trude; Gerpott, Fabiola H.; Gostautaite, Bernadeta; Halvorsen, Cal J.; Hernaus, Tomislav; Inceoglu, Ilke; Iskifoglu, Mustafa; Ivanoska, Kalina Sotiroska; Kanfer, Ruth; Kenig, Nikolina; Kiran, Sibel; Klimek, Sabina; Kunze, Florian; Mertan, Emete Biran; Varianou-Mikellidou, Cleo; Moasa, Horia; Ng, Yin Lu; Parker, Sharon K.; Reh, Susan; Resuli, Vebina; Schmeink, Martina; Silberg, Slavka; Sousa, Ines C.; Steiner, Dirk D.; Stukalina, Yulia; Tomas, Jasmina; Topa, Gabriela; Turek, Konrad; Vignoli, Michela; von Bonsdorff, Monika; Wang, Dahua; Wang, Mo; Yeung, Dannii Yuen-lan; Yildirim, Kemal; Zhang, Xin; Znidarsic, Jana",LeverAge: A European network to leverage the multi-age workforce,WORK AGING AND RETIREMENT,,English,Review,,,,,,age diversity at work; aging workforce; older adults and workers; age stereotyping and age discrimination; age-inclusive human resource management and practices,OLDER WORKERS; DISCRIMINATION; MANAGEMENT; RESOURCES; POLICIES,"Bringing together 150+ scholars and practitioners from 50+ countries, and funded by the European Commission, COST Action LeverAge (https://www.cost.eu/actions/CA22120/) is the first network-building project of its kind in the work and organizational psychology and human resource management (WOP/HRM) aspects of work and aging. Focused on the aging workforce, the Action aims to foster interdisciplinary and multinational scientific excellence and the translation of science to practical and societal impact across 4 years. Based on a research synthesis, we identify five broad research directions for work and aging science including work and organizational practices for a multi-age workforce, successful aging at work, the integration of age-diverse workers and knowledge transfer, aging and technology at work, and career development in later life and retirement. We provide key research questions to guide scientific inquiry along these five research directions alongside best practice recommendations to expand scholarly impact in WOP/HRM.","[Marcus, Justin; Al Mursi, Noura] Koc Univ, Coll Adm Sci & Econ, TR-34450 Istanbul, Turkiye; [Scheibe, Susanne] Univ Groningen, Dept Psychol, Groningen, Netherlands; [Kooij, Dorien; Turek, Konrad] Tilburg Univ, Dept Human Resource Studies, Tilburg, Netherlands; [Truxillo, Donald M.] Univ Limerick, Kemmy Business Sch, Limerick, Ireland; [Zaniboni, Sara] Univ Bologna, Dept Psychol, Bologna, Italy; [Zaniboni, Sara] Swiss Fed Inst Technol, Dept Management Technol & Econ, Zurich, Switzerland; [Abuladze, Liili] Tallinn Univ, Estonian Inst Populat Studies, Sch Governance Law & Soc, Tallinn, Estonia; [Bamberger, Peter A.] Tel Aviv Univ, Coller Sch Management, Tel Aviv, Israel; [Balytska, Mariia] Taras Shevchenko Natl Univ Kyiv, Fac Econ, Dept Insurance Banking & Risk Management, Kiev, Ukraine; [Betanzos, Norma D.] Univ Autonoma Estado Morelos, Fac Accounting Adm & Informat, Cuernavaca 62209, Mexico; [Perek-Bialas, Jolanta] Jagiellonian Univ, Inst Sociol, Fac Philosophy, Ctr Evaluat & Publ Pol Anal, Krakow, Poland; [Perek-Bialas, Jolanta; Klimek, Sabina] SGH Warsaw Sch Econ, Warsaw, Poland; [Boehm, Stephan Alexander] Univ St Gallen, Ctr Disabil & Integrat, St Gallen, Switzerland; [Burmeister, Anne] Univ Cologne, Fac Management Econ & Social Sci, Cologne, Germany; [Cabib, Ignacio] Pontificia Univ Catolica Chile, Inst Sociol, Dept Salud Publ, Santiago, Chile; [Cabib, Ignacio] Pontificia Univ Catolica Chile, Ctr UC Estudios Vejez & Envejecimiento CEVE UC, Santiago, Chile; [Caon, Maurizio] Univ Appl Sci & Arts Western Switzerland, Sch Management Fribourg, HES SO, Fribourg, Switzerland; [Deller, Juergen] Leuphana Univ, Inst Management & Org, Luneburg, Germany; [Deller, Juergen] Silver Workers Res Inst, Berlin, Germany; [Derous, Eva] Univ Ghent, Fac Psychol & Educ Sci, Ghent, Belgium; [Drury, Lisbeth] Univ London, Birkbeck Coll, Birkbeck Business Sch, London, England; [Eppler-Hattab, Raphael] Univ Haifa, Fac Social Welf & Hlth Sci, Minerva Ctr Intersect Aging, Haifa, Israel; [Fasbender, Ulrike] Univ Hohenheim, Business & Org Psychol, Stuttgart, Germany; [Fueloep, Marta] HUN REN Inst Cognit Neurosc & Psychol, Res Ctr Nat Sci, Budapest, Hungary; [Fueloep, Marta] Karol Gaspar Univ Reformed Church, Nagykoros, Hungary; [Furunes, Trude] Univ Stavanger, Norwegian Sch Hotel Management, Stavanger, Norway; [Gerpott, Fabiola H.] WHU Otto Beisheim Sch Management, Chair Leadership, Dusseldorf, Germany; [Gostautaite, Bernadeta] ISM Univ Management & Econ, Vilnius, Lithuania; [Gostautaite, Bernadeta] Vilnius Univ, Vilnius, Lithuania; [Halvorsen, Cal J.] Boston Coll, Sch Social Work, Koller, MA USA; [Hernaus, Tomislav] Univ Zagreb, Fac Econ & Business, Zagreb, Croatia; [Hernaus, Tomislav; Znidarsic, Jana] Univ Ljubljana, Sch Econ & Business, Ljubljana, Slovenia; [Inceoglu, Ilke; Reh, Susan] Univ Exeter, Business Sch, Exeter, England; [Iskifoglu, Mustafa; Yildirim, Kemal] MAN Turkiye AS, Ankara, Turkiye; [Ivanoska, Kalina Sotiroska; Kenig, Nikolina] Ss Cyril & Methodius Univ Skopje, Inst Psychol, Fac Philosophy, Skopje, North Macedonia; [Kanfer, Ruth] Georgia Inst Technol, Sch Psychol, Atlanta, GA USA; [Kiran, Sibel] Koc Univ, Sch Med, Dept Publ Hlth, Istanbul, Turkiye; [Kunze, Florian] Univ Konstanz, Chair Org Behav, Constance, Germany; [Mertan, Emete Biran] Eastern Mediterranean Univ, Dept Psychol, Famagusta, North Cyprus, Turkiye; [Varianou-Mikellidou, Cleo] CERIDES European Univ Cyprus, Nicosia, Cyprus; [Moasa, Horia] Univ Transylvania, Dept Social Sci & Commun, Brasov, Romania; [Parker, Sharon K.] Curtin Univ, Future Work Inst, Ctr Transformat Work Design, Perth, WA, Australia; [Resuli, Vebina] Mediterranean Univ Albania, Dept Econ, Tirana, Albania; [Schmeink, Martina] Demog Netzwerk eV, Berlin, Germany; [Silberg, Slavka] Palacky Univ Olomouc, Dept Psychol, Olomouc, Czech Republic; [Sousa, Ines C.] ISCTE Inst Univ Lisboa, CIES Iscte, Lisbon, Portugal; [Steiner, Dirk D.] Univ Cote dAzur, LAPCOS, Nice, France; [Stukalina, Yulia] Transport & Telecommun Inst, Riga, Latvia; [Tomas, Jasmina] Univ Zagreb, Dept Psychol, Zagreb, Croatia; [Topa, Gabriela] Univ Nacl Educ Distancia UNED, Fac Psychol, Dept Social & Org Psychol, Madrid, Spain; [Vignoli, Michela] Univ Trento, Dept Psychol & Cognit Sci, Rovereto, Italy; [von Bonsdorff, Monika] Univ Jyvaskyla, Jyvaskyla Univ Sch Business & Econ, Jyvaskyla, Finland; [Wang, Dahua] Beijing Normal Univ, Inst Dev Psychol, Beijing, Peoples R China; [Wang, Mo] Univ Florida, Warrington Coll Business, Gainesville, FL USA; [Yeung, Dannii Yuen-lan] City Univ Hong Kong, Dept Social & Behav Sci, Kowloon Tong, Hong Kong, Peoples R China; [Zhang, Xin] Peking Univ, Sch Psychol & Cognit Sci, Beijing Key Lab Behav & Mental Hlth, Beijing, Peoples R China",Koc University; University of Groningen; Tilburg University; University of Limerick; University of Bologna; Swiss Federal Institutes of Technology Domain; ETH Zurich; Tallinn University; Tel Aviv University; Ministry of Education & Science of Ukraine; Taras Shevchenko National University of Kyiv; Universidad Autonoma del Estado de Morelos; Jagiellonian University; Warsaw School of Economics; University of St Gallen; University of Cologne; Pontificia Universidad Catolica de Chile; Pontificia Universidad Catolica de Chile; University of Applied Sciences & Arts Western Switzerland; Leuphana University Luneburg; Ghent University; University of London; Birkbeck University London; University of Haifa; University Hohenheim; HUN-REN; HUN-REN Research Centre for Natural Sciences; Universitetet i Stavanger; WHU - Otto Beisheim School of Management; ISM University of Management & Economics; Vilnius University; University of Zagreb; University of Ljubljana; University of Exeter; MAN Turkiye; Saints Cyril & Methodius University of Skopje; University System of Georgia; Georgia Institute of Technology; Koc University; University of Konstanz; Eastern Mediterranean University; Transylvania University of Brasov; Curtin University; Palacky University Olomouc; Instituto Universitario de Lisboa; Universite Cote d'Azur; Transport & Telecommunication Institute - Latvia; University of Zagreb; Universidad Nacional de Educacion a Distancia (UNED); University of Trento; University of Jyvaskyla; Beijing Normal University; State University System of Florida; University of Florida; City University of Hong Kong; Peking University,"Marcus, J (corresponding author), Koc Univ, Coll Adm Sci & Econ, TR-34450 Istanbul, Turkiye.",jmarcus@ku.edu.tr,"Deller, Jürgen/A-7638-2008; Turek, Konrad/ABF-6593-2021; Vignoli, Michela/K-4136-2015; Stukalina, Yulia/AAU-2859-2020; Gostautaite, Bernadeta/LIG-0796-2024; Topa, Gabriela/L-9061-2014; Ivanoska, Kalina/ABH-3748-2020; Perek-Białas, Jolanta/AAD-9629-2019; Bamberger, Peter/M-3345-2013; Hernaus, Tomislav/G-7579-2012; Marcus, Justin/ABA-9123-2021; Kunze, Florian/J-6844-2015; Silberg, Slavka/GSN-0937-2022; Carneiro e Sousa, Inês/AAZ-9975-2021; Cabib, Ignacio/H-5998-2016; Kıran, Sibel/AAH-1173-2020; Fulop, Marta/AAB-7446-2019; Derous, Eva/AEX-1609-2022; Balytska, Mariia/Y-3412-2018; Moasa, Horia/AAC-7263-2021; Burmeister, Anne/O-5034-2019; Scheibe, Susanne/G-6017-2012; von Bonsdorff, Monika/D-3049-2014; Kenig, Nikolina/JBD-7455-2023; Yeung, Dannii/K-4183-2012; Fasbender, Ulrike/AAL-1635-2021; Gerpott, Fabiola H/I-7052-2015; Abuladze, Liili/GSE-6102-2022; Truxillo, Donald/MTC-0889-2025","Silberg, Slavka/0000-0001-6710-9463; Carneiro e Sousa, Inês/0000-0001-7438-819X; Cabib, Ignacio/0000-0002-9918-8562; Kıran, Sibel/0000-0002-4191-113X; Moasa, Horia/0000-0001-8269-5683; ury, Lisbeth/0000-0002-0964-7068; Varianou-Mikellidou, Cleo/0000-0002-9545-1749; Scheibe, Susanne/0000-0003-1001-6199; von Bonsdorff, Monika/0000-0002-4689-2126; Fasbender, Ulrike/0000-0001-6711-5732; Gerpott, Fabiola H/0000-0002-2585-3427; Abuladze, Liili/0000-0002-0109-9757; Caon, Maurizio/0000-0003-4050-4214;",,,"The first five authors contributed significantly to the manuscript development. All other authors, who helped secure funding for the project and/or are significantly involved in the project administration, are listed by alphabetical order of last name.",38,6,6,8,51,OXFORD UNIV PRESS,OXFORD,"GREAT CLARENDON ST, OXFORD OX2 6DP, ENGLAND",2054-4642,2054-4650,,WORK AGING RETIRE,Work Aging Retire.,JUN 26,2024,10.0,4,,,,309,316,,10.1093/workar/waae009,http://dx.doi.org/10.1093/workar/waae009,JUN 2024,8,"Industrial Relations & Labor; Psychology, Applied; Management",Social Science Citation Index (SSCI),Business & Economics; Psychology,H0K3U,,"Green Submitted, hybrid",2026-03-01,WOS:001253841700001,View Full Record in Web of Science
J,"O'Brien, KK; Ibáñez-Carrasco, F; Birtwell, K; Donald, G; Brown, DA; Eaton, AD; Kasadha, B; Stanmore, E; Clair-Sullivan, NS; Townsend, L; Vera, JH; Solomon, P",,,"O'Brien, Kelly K.; Ibanez-Carrasco, Francisco; Birtwell, Kelly; Donald, Graeme; Brown, Darren A.; Eaton, Andrew D.; Kasadha, Bakita; Stanmore, Emma; St. Clair-Sullivan, Natalie; Townsend, Liam; Vera, Jaime H.; Solomon, Patricia","Research priorities in HIV, aging and rehabilitation: building on a framework with the Canada-International HIV and Rehabilitation Research Collaborative",AIDS RESEARCH AND THERAPY,,English,Article,,,,,,HIV; Disability; Rehabilitation; Research priorities; Aging,LONG-TERM SUCCESS; TECHNOLOGY; ADULTS,"BackgroundIn 2016, the Canada-International HIV and Rehabilitation Research Collaborative established a framework of research priorities in HIV, aging and rehabilitation. Our aim was to review and identify any new emerging priorities from the perspectives of people living with HIV, clinicians, researchers, and representatives from community organizations.MethodsWe conducted a multi-stakeholder international consultation with people living with HIV, researchers, clinicians and representatives of community-based organizations. Stakeholders convened for a one-day Forum in Manchester, United Kingdom (UK) to discuss research priorities via a web-based questionnaire and facilitated discussions. We analyzed data using conventional content analytical techniques and mapped emerging priorities onto the foundational framework.ResultsThirty-five stakeholders from the UK(n = 29), Canada(n = 5) and Ireland(n = 1) attended the Forum, representing persons living with HIV or representatives from community-based organizations(n = 12;34%), researchers or academics(n = 10;28%), service providers(n = 6;17%), clinicians(n = 4;11%); and trainees(n = 4;11%). Five priorities mapped onto the Framework of Research Priorities across three content areas: A-Episodic Health and Disability Aging with HIV (disability, frailty, social participation), B-Rehabilitation Interventions for Healthy Aging across the Lifespan (role, implementation and impact of digital and web-based rehabilitation interventions) and C-Outcome Measurement in HIV and Aging (digital and web-based rehabilitation health technology to measure physical activity). Stakeholders indicated methodological considerations for implementing digital and web-based rehabilitation interventions into research and practice and the importance of knowledge transfer and exchange among the broader community.ConclusionResults highlight the sustained importance of the Framework of Research Priorities and provide further depth and areas of inquiry related to digital and web-based rehabilitation interventions and technology aging with HIV.","[O'Brien, Kelly K.] Univ Toronto, Temerty Fac Med, Dept Phys Therapy, 160-500 Univ Ave, Toronto, ON M5G 1V7, Canada; [O'Brien, Kelly K.] Univ Toronto, Inst Hlth Policy Management & Evaluat IHPME, Dalla Lana Sch Publ Hlth, 155 Coll St,4th Floor, Toronto, ON M5T 3M7, Canada; [O'Brien, Kelly K.] Univ Toronto, Rehabil Sci Inst RSI, 500 Univ Ave,Room 160, Toronto, ON M5G 1V7, Canada; [Ibanez-Carrasco, Francisco] Univ Toronto, Dalla Lana Sch Publ Hlth, 155 Coll St,4th Floor, Toronto, ON M5T 3M7, Canada; [Birtwell, Kelly] Univ Manchester, Ctr Primary Care, Hlth Serv Res, Oxford Rd, Manchester M13 9PL, England; [Donald, Graeme; Stanmore, Emma] Univ Manchester, Fac Biol, Sch Hlth Sci, Div Nursing Midwifery & Social Work, Oxford Rd, Manchester M13 9PL, England; [Brown, Darren A.] Chelsea & Westminster Hosp NHS Fdn Trust, Therapies Dept, London, England; [Eaton, Andrew D.] Univ Regina, Fac Social Work, Saskatoon Campus,111-116 Res Dr, Saskatoon, SK S7N 3R3, Canada; [Eaton, Andrew D.] Univ Toronto, Factor Inwentash Fac Social Work, 246 Bloor St, Toronto, ON M5S 1V4, Canada; [Kasadha, Bakita] Univ Oxford, Nuffield Dept Primary Care Hlth Sci, Med Sci Div, Radcliffe Observ Quarter, Radcliffe Primary Care Bldg,Woodstock Rd, Oxford OX2 6GG, England; [Stanmore, Emma] Univ Manchester, Hlth Ageing Res Grp HARG, Manchester, England; [St. Clair-Sullivan, Natalie; Vera, Jaime H.] Brighton & Sussex Univ Hosp NHS Trust, Royal Sussex Cty Hosp, Lawson Unit, Eastern Rd, Brighton BN2 5BE, England; [Townsend, Liam] St James Hosp, Dept Infect Dis, Dublin, Ireland; [Townsend, Liam] St James Hosp, Trinity Translat Med Inst, Trinity Coll Dublin, Sch Med,Dept Clin Med, Dublin 8, Ireland; [Vera, Jaime H.] Univ Sussex, Brighton & Sussex Med Sch, Dept Global Hlth & Infect, Brighton BN1 9PX, England; [Solomon, Patricia] McMaster Univ, Sch Rehabil Sci, 1400 Main St West,Room 403, Hamilton, ON L8S 1C7, Canada",University of Toronto; University of Toronto; University of Toronto; University of Toronto; University of Manchester; University of Manchester; Imperial College London; University of Regina; University of Toronto; University of Oxford; University of Manchester; Brighton and Sussex University Hospitals NHS Trust; University of Brighton; Trinity College Dublin; Trinity College Dublin; University of Brighton; University of Sussex; McMaster University,"O'Brien, KK (corresponding author), Univ Toronto, Temerty Fac Med, Dept Phys Therapy, 160-500 Univ Ave, Toronto, ON M5G 1V7, Canada.;O'Brien, KK (corresponding author), Univ Toronto, Inst Hlth Policy Management & Evaluat IHPME, Dalla Lana Sch Publ Hlth, 155 Coll St,4th Floor, Toronto, ON M5T 3M7, Canada.;O'Brien, KK (corresponding author), Univ Toronto, Rehabil Sci Inst RSI, 500 Univ Ave,Room 160, Toronto, ON M5G 1V7, Canada.",kelly.obrien@utoronto.ca,"Stanmore, Emma/F-1157-2010; Kasadha, Bakita/ACI-4109-2022; Townsend, Liam/ABH-3502-2020; Donald, Graeme/O-1320-2015; Ibanez-Carrasco, Francisco/AAY-2773-2021; O'Brien, Kelly K/AFM-2205-2022; Birtwell, Kelly/AAW-1728-2020; Eaton, Anew David/AAG-9534-2020; Brown OBE, Darren A/HSH-3854-2023","Stanmore, Emma/0000-0002-4522-5292; Kasadha, Bakita/0000-0003-2862-183X; Townsend, Liam/0000-0002-7089-0665; Donald, Graeme/0000-0002-5405-9222; Ibanez-Carrasco, Francisco/0000-0002-3667-6411; O'Brien, Kelly K/0000-0002-1632-6537; St Clair-Sullivan, Natalie/0000-0003-1097-0759; Birtwell, Kelly/0000-0003-0285-2939; Eaton, Anew David/0000-0003-1331-1222; Brown OBE, Darren A/0000-0002-4956-243X; Vera, Jaime/0000-0002-1165-0573",University of Toronto and University of Manchester (Partnership Grant); Terence Higgins Trust,University of Toronto and University of Manchester (Partnership Grant); Terence Higgins Trust,"We acknowledge the following stakeholders who were involved in the consultation on research priorities and attended the International Forum on HIV and Rehabilitation Research that include (in alphabetical order): Akin Akintayo; Amanda; Helen Anderson (Blue Sky Trust), Elaine Fell (Volunteer, Terence Higgins Trust); Patriic Gayle (Gay Men's Health Collective (GMHC)); Claire Grainger; Christopher Hodgson; Anna Hughes (Project Coordinator, George House Trust); Jo Josh (Communications Officer, British HIV Association); Vesile Yildiz Kabak; Dr. Chrysi Leliopoulou (Middlesex University); Irvine Mangawa (North Manchester General Hospital); Esther McDonnell (Rehabilitation in HIV Association (RHIVA)); Chantal Mukandoli; Nora; Sandra Osaghae; Yvonne Richards (BHA Community Engagement & GHT Volunteer Women's Supporter); Dana Rosenfeld (University of Westminster); Alex Sparrowhawk (Terrence Higgins Trust and UK Community Advisory Board (UK-CAB)); Jack Summerside; Lyn Tobias; Brittany Torres (Department of Physical Therapy, University of Toronto); and Jeff Ukiri (African Men's Engagement Worker).",46,3,3,0,1,BMC,LONDON,"CAMPUS, 4 CRINAN ST, LONDON N1 9XW, ENGLAND",1742-6405,,,AIDS RES THER,Aids Res. Ther.,DEC 9,2023,20.0,1,,,,,,86,10.1186/s12981-023-00582-4,http://dx.doi.org/10.1186/s12981-023-00582-4,,10,Infectious Diseases,Science Citation Index Expanded (SCI-EXPANDED),Infectious Diseases,AH8J0,38071351.0,"Green Submitted, gold",2026-03-01,WOS:001117662300001,View Full Record in Web of Science
