J,"Dhir, SB; Mishra, G",,,"Dhir, Samanta Biswabhusan; Mishra, Gyanaranjan",Digital agriculture mission: unlocking opportunities and overcoming challenges for farmers using smartphones,JOURNAL OF INFORMATION COMMUNICATION & ETHICS IN SOCIETY,,English,Article; Early Access,,,,,,Digital inclusion; Information gap; ICT; Diffusion of innovation; SDGs; Opinion leaders,INFORMATION,"PurposeAgriculture is shifting with innovation and technology to develop farmers' livelihoods. Smartphones are promising to change the lifestyles of future agriculture and farmers. The association between farmers, agro-communities, agro-scientists and government institutions comes together with digital information and the adoption of smartphones. In this way, the digital agricultural mission vision will be an outstanding achievement for the central government.Design/methodology/approachThis study used a mixed-methods approach comprising quantitative surveys and qualitative interviews applied in the study, revealing factors such as knowledge transfer, agricultural extension, digital divide, digital marginalization, rural digital access, educational digital gap, socio-economic access and disparity, mobile device penetration, digital literacy programs, affordable Internet access, public-private digital partnerships and technology adoption.FindingsSmartphones can transform Indian agriculture, but affordability, digital literacy, connectivity and language barriers to access remain barriers to adoption and utilization. The government should support farmers through subsidized smartphones with data plans, rural connectivity and education on digital skills and resources. Increasing the agricultural information available in local languages will help to reduce some of the barriers to access, particularly for older farmers and farmers who may have more limited education. Digital tools and incentives, such as social media or applications, could increase youth engagement and interest in progressive farming. Closing the youth technology and non-smartphone user gap will depend on localized training and low-cost plans and programs. Nevertheless, a true game-changer will be a holistic approach to agricultural transformation, which incorporates education, technology and funding.Research limitations/implicationsThe qualitative analysis from in-depth interviews established these quantitative understandings related to the adoption of smartphones among the farmers for agricultural innovations. In the course of interviews, the participants from varied backgrounds emphasized the factors such as knowledge transfer, agricultural extension, digital divide, digital marginalization, rural digital access, educational digital gap, socio-economic access and disparity, mobile device penetration, digital literacy programs, affordable internet access, public-private digital partnerships and technology adoption. All these perspectives are pitched for inclusive technologies for the attainment of farmers' empowerment.Practical implicationsThis study used surveys and interviews to provide a stronger and richer understanding of farmer behaviours and technology uptake, as well as system-level barriers. Survey methods provided the basis for quantitative data so researchers can examine patterns in, for example, smartphone ownership, app usage or access to digital services across a wider sample of farmers. Mixed-methods research facilitated the researchers gaining context on the reasons behind those patterns using interviews, such as trust in technology, cultural practices, digital literacy or access to a local innovation ecosystem.Social implicationsSmartphone adoption among Indian farmers has profound social implications. It empowers rural communities through access to timely agricultural information, reduces generational and regional gaps in digital usage and fosters peer-to-peer learning via social media. With affordable access, even marginalized groups gain digital inclusion, enhancing equity. These devices also facilitate economic mobility by connecting farmers directly to markets and financial services. However, challenges such as misinformation and digital literacy persist. Overall, smartphones are reshaping rural identities, transforming traditional farming into a more connected, informed and resilient livelihood.Originality/valueThis study extends the diffusion of innovation theory by contributing to a deeper understanding of the socio-technical dynamics influencing digital transformation in agriculture. Its application in study provides newer insight into the stages of adoption - knowledge, persuasion, decision, implementation and confirmation. This study highlights the practical implications, indicating the role of village headmen, extension communication officers, subsidies for farmers to procure smartphones and conducting digital media campaigns, which have sought an overhaul in the public policy. This study also focuses on innovative digitalized agriculture, which has the potential to significantly advance the sustainable development goals by enhancing productivity, reducing environmental impact and promoting inclusive growth.","[Dhir, Samanta Biswabhusan; Mishra, Gyanaranjan] Birla Global Univ, Dept Journalism & Mass Commun, Bhubaneswar, India",,"Dhir, SB (corresponding author), Birla Global Univ, Dept Journalism & Mass Commun, Bhubaneswar, India.",sbdhir@gmail.com; gyanaranjan.mishra@bgu.ac.in,"Dhir, Samanta Biswabhusan/PEX-7097-2025","Dhir, Samanta Biswabhusan/0009-0003-3678-6500",,,,63,0,0,5,5,EMERALD GROUP PUBLISHING LTD,Leeds,"Floor 5, Northspring 21-23 Wellington Street, Leeds, W YORKSHIRE, ENGLAND",1477-996X,1758-8871,,J INF COMMUN ETHICS,J. Inf. Commun. Ethics Soc.,2025 OCT 15,2025,,,,,,,,,10.1108/JICES-01-2025-0020,http://dx.doi.org/10.1108/JICES-01-2025-0020,OCT 2025,20,Ethics,Emerging Sources Citation Index (ESCI),Social Sciences - Other Topics,8MH6Q,,,2026-03-01,WOS:001592062500001,View Full Record in Web of Science
J,"Ding, YJ; Wang, H; Wang, X; Angula, LN; Fang, N",,,"Ding, Yingjie; Wang, Heng; Wang, Xin; Angula, Laina Ndapewa; Fang, Ning","Exploring the Multidimensional Advantages of Productive Failure in Cultivating Clinical Thinking, Collaboration, Stress Management, and Learning Retention in Resident Physicians",ADVANCES IN MEDICAL EDUCATION AND PRACTICE,,English,Review,,,,,,stress management; productive failure; clinical reasoning; resident physicians; collaborative learning,CHALLENGES; STRATEGIES; TEAMWORK; FEEDBACK; IMPROVE,"The Productive Failure (PF) technique is an educational strategy that uses collaborative problem-solving to facilitate resident physicians' understanding of new concepts. A novel implementation of this approach is PF simulation, in which they engage in simulation before receiving comprehensive teaching on the involved aspects. PF commences with the generation and consolidation phases, where resident physicians develop and analyze the advantages and constraints of various Representations and Solution Methods. These are followed by the knowledge assembly phases, respectively. Wherein physicians gain essential concepts by organizing their representations and thoughts in alignment with established responses. PF is deliberately designed to induce failure in problem-solving; however, in the following review, this process of failure can help resident physicians better acquire target ideas. The crucial aspect of PF design is that throughout the problem-solving phase, physicians receive no instructional support or scaffolding. Explicit failure-driven scaffolding is an alternative method for enhancing the efficacy of preparatory problem-solving. This narrative review examines the theoretical foundation of PF and its role in collaboration, clinical reasoning development, stress management, and knowledge retention among resident physicians. Using cognitive psychology, clinical reasoning theories, and reflective practice, we examined how PF helps people learn from failure, shift from traditional teaching to retain knowledge longterm, and develop flexible skills in complex clinical settings. Highlighting these components underscores the significance of practical simulations, varied information sources, and systematic feedback in cultivating these competencies. The role of PF in medical education policy suggests ways to integrate it into future training models to address current curriculum gaps. Future directions for PF in medical education include individualized learning, interdisciplinary collaboration, and the integration of future technologies such as virtual reality (VR). PF constitutes a viable educational approach for augmenting the clinical and cognitive competencies of resident physicians, equipping them with the intricacies of contemporary medical practices.","[Ding, Yingjie; Wang, Heng; Wang, Xin; Angula, Laina Ndapewa; Fang, Ning] Jilin Univ, Dept Otorhinolaryngol, Hosp 1, Changchun 130021, Jilin, Peoples R China",Jilin University,"Fang, N (corresponding author), Jilin Univ, Dept Otorhinolaryngol, Hosp 1, Changchun 130021, Jilin, Peoples R China.",fn2017@jlu.edu.cn,,,"Jilin Province Postgraduate Education and Teaching Reform Research Project [20241994G99005B, 202419925EH001P]; Jilin Provincial Higher Education Teaching Reform Research Project [2024L5LJO6C000X]",Jilin Province Postgraduate Education and Teaching Reform Research Project; Jilin Provincial Higher Education Teaching Reform Research Project,"Jilin Province Postgraduate Education and Teaching Reform Research Project (20241994G99005B, 202419925EH001P) . Jilin Provincial Higher Education Teaching Reform Research Project (2024L5LJO6C000X) .",78,0,0,0,0,DOVE MEDICAL PRESS LTD,ALBANY,"PO BOX 300-008, ALBANY, AUCKLAND 0752, NEW ZEALAND",1179-7258,,,ADV MED EDUC PRACT,Adv. Med. Educ. Pract.,,2025,16.0,,,,,2491,2505,,10.2147/AMEP.S546816,http://dx.doi.org/10.2147/AMEP.S546816,,15,"Education, Scientific Disciplines",Emerging Sources Citation Index (ESCI),Education & Educational Research,AR1RY,41497739.0,"Green Submitted, gold",2026-03-01,WOS:001654794800001,View Full Record in Web of Science
C,"Rusch, T; Ottersböck, N; Stowasser, S","Nah, F; Siau, K",,"Rusch, Tobias; Ottersboeck, Nicole; Stowasser, Sascha",Participative Process Model for the Introduction of AI-Based Knowledge Management in Production,"HCI IN BUSINESS, GOVERNMENT AND ORGANIZATIONS, PT II, HCIBGO 2023",Lecture Notes in Computer Science,English,Proceedings Paper,"10h International Conference on HCI in Business, Government and Organizations (HCIBGO) Part of the 24th International Conference on Human-Computer Interaction (HCI)","JUL 23-28, 2023","Copenhagen, DENMARK",,,AI; knowledge transfer; skills shortage,,"The growing shortage of skilled workers and the large number of employees from the 1960s so-called baby boom generation who will be retiring in the next few years are current and growing major challenges for companies in Germany. When people retire, companies can lose a lot of valuable know-how and experience. Experienced professionals enjoy a special status in companies because of their extensive and in-depth knowledge of work processes. Salaries and positions in companies are often linked to knowledge. The fear of losing status or even financial loss by sharing knowledge can be a reason for employees to keep their knowledge to themselves. The use of new technologies such as artificial intelligence in companies can also trigger several fears among employees like fears regarding job loss, new skill requirements or surveillance. An innovative work culture, where knowledge sharing is actively encouraged, required and rewarded, is not successfully implemented everywhere. A particular challenge in the KI_eeper project is to convince experienced employees in the participating organizations of the importance of sharing and preserving knowledge to ensure the company's long-term competitiveness. The aim is to encourage them to provide their knowledge to other employees with the help of an AI assistance system. In addition to the development of an assistance system, an important task of the project is the development of methods promoting knowledge transfer and contributing to the acceptance of the use of the new technology. Information and awareness-raising workshops with managers and employees have been designed and tested in the companies. Employees are involved in the development of the system in a participatory approach. This ensures that the system can be developed in a user- and needs-orientedmanner and thus the acceptance of the system's use in future everyday work can be promoted, which is crucial for long-term successful application.","[Rusch, Tobias; Ottersboeck, Nicole; Stowasser, Sascha] Inst Appl Ind Engn & Ergon, Uerdinger Str 56, D-40474 Dusseldorf, Germany",,"Rusch, T (corresponding author), Inst Appl Ind Engn & Ergon, Uerdinger Str 56, D-40474 Dusseldorf, Germany.",t.rusch@ifaa-mail.de,,,German Federal Ministry of Education and Research (BMBF) [02L20C500- 02L20C505],German Federal Ministry of Education and Research (BMBF)(Federal Ministry of Education & Research (BMBF)),This research and development project is funded by the German Federal Ministry of Education and Research (BMBF) within the framework of the program Zukunft der Arbeit (funding codes 02L20C500- 02L20C505) and is supervised by the Project Management Agency Karlsruhe (PTKA). The responsibility for the content of this publication lies with the authors.,9,0,0,3,7,SPRINGER INTERNATIONAL PUBLISHING AG,CHAM,"GEWERBESTRASSE 11, CHAM, CH-6330, SWITZERLAND",0302-9743,1611-3349,978-3-031-36048-0; 978-3-031-36049-7,LECT NOTES COMPUT SC,,,2023,14039.0,,,,,181,191,,10.1007/978-3-031-36049-7_14,http://dx.doi.org/10.1007/978-3-031-36049-7_14,,11,"Business, Finance; Computer Science, Cybernetics; Computer Science, Information Systems; Computer Science, Interdisciplinary Applications",Conference Proceedings Citation Index - Science (CPCI-S); Conference Proceedings Citation Index - Social Science & Humanities (CPCI-SSH),Business & Economics; Computer Science,BX5AL,,,2026-03-01,WOS:001297281100014,View Full Record in Web of Science
J,"Lu, XY; Liu, ZY; Liu, HY; Lin, J",,,"Lu, Xinyu; Liu, Zongyang; Liu, Hanyang; Lin, Jing",Digital twin-driven unsupervised waveform segmentation for bearing quantitative diagnosis,ADVANCED ENGINEERING INFORMATICS,,English,Article,,,,,,Waveform segmentation; Digital twin; Bearing quantitative diagnosis; Unsupervised transfer learning; Interpretability,ROLLING ELEMENT BEARING; FAULT,"The quantitative diagnosis of bearing is a prerequisite for informed maintenance decisions, ensuring the highefficiency operation of modern production facilities. Existing studies utilize dual-impulse extraction-based signal processing techniques or neural network-based intelligent methods for defect size estimation. However, the former is subject to expert knowledge and complicated interferences, while the latter is limited by data resources and black-box attributes. Simulation-based digital twin (DT) technology provides intrinsic mechanism insights and cost-effective data generation. Inspired by this, a DT-driven unsupervised waveform segmentation (DTUWS) method is proposed in this paper to address the above problems. Specifically, a high-fidelity DT model of bearing is first established based on the modeling-update concept of DT technology. The hyper-real observation capability of the DT model is leveraged to generate vibration responses and pixel-level fault semantic labels. Then, the U-Net structure is combined with multi-task learning to construct an unsupervised waveform segmentation model for feature extraction and knowledge transfer. The predicted semantic labels of unlabeled raw field signals are post-processed to derive defect sizes. The diagnosis mechanism of DTUWS is intuitive and interpretable. Experiments on two distinct bench tests demonstrate that DTUWS can achieve accurate and robust quantitative diagnosis without field pre-testing and manual feature extraction.","[Lu, Xinyu; Liu, Zongyang; Liu, Hanyang; Lin, Jing] Beihang Univ, Sch Reliabil & Syst Engn, Beijing 100191, Peoples R China",Beihang University,"Lin, J (corresponding author), Beihang Univ, Sch Reliabil & Syst Engn, Beijing 100191, Peoples R China.",xinyulu@buaa.edu.cn; zoneliu@buaa.edu.cn; lhy2020@buaa.edu.cn; linjing@buaa.edu.cn,"LIU, Zongyang/PIH-2757-2026; lu, xinyu/OOK-6840-2025","lu, xinyu/0009-0008-9034-6545",National Natural Science Foundation of China [52235002],National Natural Science Foundation of China(National Natural Science Foundation of China (NSFC)),This work is supported by the National Natural Science Foundation of China under Grant 52235002.,44,0,0,20,20,ELSEVIER SCI LTD,London,"125 London Wall, London, ENGLAND",1474-0346,1873-5320,,ADV ENG INFORM,Adv. Eng. Inform.,JAN,2026,69.0,,A,,,,,103833,10.1016/j.aei.2025.103833,http://dx.doi.org/10.1016/j.aei.2025.103833,SEP 2025,14,"Computer Science, Artificial Intelligence; Engineering, Multidisciplinary",Science Citation Index Expanded (SCI-EXPANDED),Computer Science; Engineering,7HX7V,,,2026-03-01,WOS:001571436300003,View Full Record in Web of Science
J,"Galdames, IS; de Toro, X; Acevedo, D",,,"Galdames, Ivan Suazo; de Toro, Ximena; Acevedo, Dinka",Bridging Science and Society: The Role of University Science Communication Centers,EUROPEAN JOURNAL OF EDUCATION AND PSYCHOLOGY,,English,Article,,,,,,knowledge management; scientific communication; higher education; scientific literacy; open science,MODE 2,"The article addresses the interaction between science and society, focusing on the role of higher education institutions in promoting scientific literacy and knowledge management. It presents the case of a university Science Communication Center (SCC), exploring how this center contributes to effective linking between academia and the community through a dynamic knowledge management model. This model is structured in three phases: knowledge generation, knowledge transfer, and societal feedback, thus facilitating a continuous cycle of interaction and improvement. The article highlights the importance of scientific education from an early age and how it influences public perception and the utility of science in everyday life. It discusses the need for more robust public policies to address inequalities in access and performance in science and technology in Chile, exacerbated by the COVID-19 pandemic. Additionally, the SCC's open science approach is emphasized, which seeks to democratize access to scientific knowledge and foster more active public participation in science. The document concludes that, despite challenges such as funding and impact measurement, effective management of scientific knowledge and public science communication are essential for an informed and engaged society. This case serves as a reference for other institutions aspiring to enhance the interaction between science and society, highlighting the transformative role that universities can play in this process.","[Galdames, Ivan Suazo; de Toro, Ximena; Acevedo, Dinka] Univ Autonoma Chile, Providencia, Chile",Universidad Autonoma de Chile,"Galdames, IS (corresponding author), Univ Autonoma Chile, Providencia, Chile.",ivan.suazo@uautonoma.cl,"DE TORO CONSUAGRA, XIMENA/HJB-2928-2022; Suazo Galdames, Ivan/A-3064-2009","DE TORO CONSUAGRA, XIMENA/0000-0002-9147-023X; Suazo Galdames, Ivan/0000-0002-1689-1632; Acevedo, Dinka/0009-0001-6054-9148",,,,43,2,2,3,19,Universidad Autonoma de Chile,SANTIAGO,"Pedro de Valdivia 425, PROVIDENCIA, SANTIAGO, CHILE",1888-8992,1989-2209,,EUR J EDUC PSYCHOL,EUROPEAN J ED PSYCHOL,JUN,2024,17.0,1,,,,,,2551,10.32457/ejep.v17i1.2551,http://dx.doi.org/10.32457/ejep.v17i1.2551,,25,"Psychology, Educational",Emerging Sources Citation Index (ESCI),Psychology,XP6J8,,gold,2026-03-01,WOS:001262921900005,View Full Record in Web of Science
J,"Fong, PSW",,,"Fong, Patrick S. W.",Leveraging storytelling for effective tacit knowledge capture and management in the construction industry: framework development and empirical validation,INTERNATIONAL JOURNAL OF CONSTRUCTION MANAGEMENT,,English,Article; Early Access,,,,,,Tacit knowledge; storytelling; knowledge management systems (KMS); construction industry; knowledge capture and transfer; organizational learning; situated narratives,,"Tacit knowledge-rooted in individual experience, intuition, and skills-is vital to construction project success but remains difficult to capture and transfer. Traditional methods like interviews, documentation, and video recordings often fall short due to cultural barriers, technological limitations, and reluctance to share expertise. This study explores storytelling as an innovative, engaging method to capture tacit knowledge effectively. Here, 'storytelling' denotes construction practitioners' situated narratives that recount context, cues, decisions, and consequences from real project episodes; these narratives are captured, structured, metadata-tagged, and integrated into the Knowledge Management Systems (KMS) for retrieval and reuse. It proposes and validates a storytelling-based framework integrated into KMS specifically for the construction industry. Drawing on qualitative case studies from a major bridge project and an engineering consultancy facing mass retirements, the research illustrates how storytelling enables the elicitation, capture, and dissemination of critical knowledge. Findings show that storytelling creates a relatable and emotionally engaging environment, encouraging practitioners to share rich, context-specific narratives that traditional approaches miss. The validated framework offers practical guidance for construction firms seeking to retain expertise, improve cross-project knowledge transfer, and cultivate a learning culture. Ultimately, the storytelling approach supports better project outcomes, reduces rework, and helps safeguard the construction sector's experiential knowledge base.","[Fong, Patrick S. W.] Griffith Univ, Griffith Inst Human & Environm Resilience GIHER, Sch Engn & Built Environm, Gold Coast, Australia",Griffith University,"Fong, PSW (corresponding author), Griffith Univ, Griffith Inst Human & Environm Resilience GIHER, Sch Engn & Built Environm, Gold Coast, Australia.",patrick.fong@griffith.edu.au,,,,,,52,0,0,0,0,TAYLOR & FRANCIS LTD,ABINGDON,"2-4 PARK SQUARE, MILTON PARK, ABINGDON OR14 4RN, OXON, ENGLAND",1562-3599,2331-2327,,INT J CONSTR MANAG,Int. J. Constr. Manag.,2026 FEB 11,2026,,,,,,,,,10.1080/15623599.2026.2630239,http://dx.doi.org/10.1080/15623599.2026.2630239,FEB 2026,20,"Construction & Building Technology; Engineering, Civil; Management",Emerging Sources Citation Index (ESCI),Construction & Building Technology; Engineering; Business & Economics,DX9KI,,,2026-03-01,WOS:001694709600001,View Full Record in Web of Science
J,"Cuauro, JCA",,,"Cuauro, Juan Carlos Araujo",Implementation of new technologies. Virtual simulators in knowledge transfer in anatomical education,AVANCES EN BIOMEDICINA,,English,Article,,,,,,Simulator virtual; anatomy; technologies'; Knowledge Transfer; Learning,,"At present, scientific and technological advances affect various aspects of human life; among them, the educational sector in general and especially in medical education. This technological impact in the educational field brings with it the need to make changes in teaching practice, specifically in classroom work. Currently, the use of new technologies should be analyzed as a didactic resource and a means for the transfer of knowledge. This article aims to explore that possibility related to the use of simulators as digital support tools in the processes of knowledge transfer for basic science courses such as anatomy at the Faculty of Medicine of the University of Zulia in Maracaibo-Venezuela. A methodology was used in this article consisting of an applied, descriptive, quantitative, quantitative, non-experimental research, based on the inductive, transversal method. Results. In 95% of the respondents recognized and attributed a great importance for the anatomical knowledge of having the contribution of the use of simulators for the generation of the transfer of theoretical-practical knowledge of anatomy as an essential part of learning for their professional practice. Conclusion. the present research can serve as motivation for future research to clarify the real role of the use of virtual reality simulators in the learning process of basic sciences in medicine such as anatomy.","[Cuauro, Juan Carlos Araujo] Escuela Med Univ Zulia LUZ, Fac Med, Maracaibo, Venezuela; [Cuauro, Juan Carlos Araujo] Escuela Med Univ Zulia LUZ, Fac Med, Calle 65 con 9,Nucleo Salud,Apartado postal 15165, Maracaibo, Venezuela",,"Cuauro, JCA (corresponding author), Escuela Med Univ Zulia LUZ, Fac Med, Calle 65 con 9,Nucleo Salud,Apartado postal 15165, Maracaibo, Venezuela.",jcaraujoc_65@hotmail.com,,,,,,22,1,2,0,1,"UNIV ANDES, FAC MEDICINA",MERIDA,"AV DON TULIO FEBRES CORDERO, MERIDA, 5101, VENEZUELA",2477-9369,2244-7881,,AV BIOMED,Av. Biomed.,JUL-DEC,2022,11.0,2,,,,78,88,,,,,11,"Medicine, General & Internal",Emerging Sources Citation Index (ESCI),General & Internal Medicine,G4FT2,,,2026-03-01,WOS:000988740200001,View Full Record in Web of Science
