J,"Qonita, RRA; Masyhuri; Jamhari; Perwitasari, H",,,"Qonita, Raden Rara Aulia; Masyhuri; Jamhari, Hani; Perwitasari, Hani","Social Environmental Support in Encouraging Entrepreneurial Behavior of Millennial Farmers in the Special Region of Yogyakarta, Indonesia: An Effort to Realize Sustainable Agriculture",CARAKA TANI-JOURNAL OF SUSTAINABLE AGRICULTURE,,English,Article,,,,,,agricultural entrepreneurship; farmers' entrepreneurial behavior; media exposure,PARTICIPATION,"Sustainable agriculture offers new hope in overcoming the challenges of the decreasing interest of the younger generation in the agricultural sector. Millennial farmers, as part of this younger generation, are the key to successfully implementing sustainable agricultural development. This study aims to explore the influence of the role of parents, friends, extension workers, and media exposure on the entrepreneurial behavior of millennial farmers, and to explore the influence of entrepreneurial behavior on the financial performance of millennial farmers. The research was conducted in the Special Region of Yogyakarta, Indonesia, which was the first province to inaugurate 1,000 millennial farmers. The research sample consisted of 200 millennial farmers, selected using a simple random sampling method. The analysis employed Partial Least Square Structural Equation Modeling (PLS-SEM). The results reveal that the role of parents does not significantly influence millennial farmers' entrepreneurial behavior. The role of friends, agricultural extension workers, and media exposure significantly influence millennial farmers' entrepreneurial behavior. Friends provide motivation, support, and share information. Agricultural extension workers offer knowledge transfer, technology, and programs from the government. Media exposure contributes by providing knowledge and shaping perceptions and behavior. Entrepreneurial behavior has a positive and significant influence on financial performance. The research results impact millennial farmers' regional commissariat/farmer groups, the extension services by agricultural extension workers, and the media for millennial farmers. It is recommended that policies be implemented to strengthen the role of the regional commissariat of millennial farmers/farmer groups, improve extension services, and develop media relevant to millennial farmers.","[Qonita, Raden Rara Aulia; Masyhuri; Perwitasari, Hani] Univ Gadjah Mada, Fac Agr, Dept Agr Socioecon, Yogyakarta, Indonesia; [Qonita, Raden Rara Aulia] Univ Sebelas Maret, Fac Agr, Dept Agribusiness, Surakarta, Indonesia",Gadjah Mada University; Sebelas Maret University,"Qonita, RRA (corresponding author), Univ Gadjah Mada, Fac Agr, Dept Agr Socioecon, Yogyakarta, Indonesia.;Qonita, RRA (corresponding author), Univ Sebelas Maret, Fac Agr, Dept Agribusiness, Surakarta, Indonesia.",radenrara@staff.uns.ac.id,"Perwitasari, Hani/AAY-7999-2021; Masyhuri, Masyhuri/IYS-6003-2023",,,,,94,1,5,2,3,UNIVERSITAS SEBELAS MARET SURAKARTA,SUKARTA,"JL IR SUTAMI 36A, SUKARTA, 57126, INDONESIA",2613-9456,2599-2570,,CARAKA TANI-J SUST,Caraka Tani-J. Sustain. Agric.,JAN,2025,40.0,1,,,,64,83,,10.20961/carakatani.v40i1.92724,http://dx.doi.org/10.20961/carakatani.v40i1.92724,,20,"Agriculture, Multidisciplinary",Emerging Sources Citation Index (ESCI),Agriculture,X8X8T,,"Green Submitted, gold",2026-03-01,WOS:001428116200005,View Full Record in Web of Science
C,"Zeleznik, N","Snoj, L; Goricanec, T",,"Zeleznik, Nadja",Results from Knowledge Management Activities in EURAD,33RD INTERNATIONAL CONFERENCE NUCLEAR ENERGY FOR NEW EUROPE,,English,Proceedings Paper,33rd International Conference on Nuclear Energy for New Europe,"SEP 09-12, 2024","Portoroz, SLOVENIA",,,,,"In the EC co-funded EURAD programme (European Joint Programme on Radioactive Waste Management, 2019-2024) particular emphasis was dedicated to Knowledge Management (KM) activities to ensure the capture of existing knowledge, transfer of knowledge between member states (advanced and early-stage programmes) and management of knowledge for future generations. Within EURAD there were a variety of tools and methods that support knowledge management activities with dedicated work packages (WP). WP1 focused on EURAD roadmap activities to systematically orientate users to existing knowledge and needs for research and technology development via a generic roadmap for implementing radioactive waste management, from generation to disposal. The roadmap provides an integrated and systemic framework for organising, structuring and sharing available RWM knowledge in different levels, including themes, sub-themes and domains. Within WP11, the State of Knowledge was collected with experts' view of the most relevant knowledge and associated uncertainties in a specific domain of the roadmap applied in the context of a radioactive waste management programme. WP12 Guidance offered activities consisting of developing a comprehensive suite of instructional guidance documents that can be used by member states with RWM programmes. In WP13, Training and Mobility activities consisted of developing a diverse portfolio of tailored basic and specialised training courses taking stock of and building upon already existing initiatives and creating new initiatives to bridge the identified gaps. The paper presents the current achievement in EURAD KM activities and plans for future work in EURAD2 partnership, projected to start in October 2024.","[Zeleznik, Nadja] EIMV, Hajdrihova 2, Ljubljana 1000, Slovenia",,"Zeleznik, N (corresponding author), EIMV, Hajdrihova 2, Ljubljana 1000, Slovenia.",nadja.zeleznik@eimv.si,,,European Union [847593]; EURATOM Research and Training Programme 2019-2020 [945098],European Union(European Union (EU)); EURATOM Research and Training Programme 2019-2020(Euratom),This work received funding from the European Union's Horizon 2020 Research and Innovation Programme 2014-2018 under Grant Agreement No. 847593 (EURAD) and from the EURATOM Research and Training Programme 2019-2020 under Grant Agreement No. 945098 (PREDIS).,13,0,0,0,0,NUCLEAR SOCIETY SLOVENIA,1001 LJUBLJANA,"JAMOVA 39, 1001 LJUBLJANA, SLOVENIA",,,978-961-6207-59-1,,,,2024,,,,,,,,606,,,,8,Nuclear Science & Technology,Conference Proceedings Citation Index - Science (CPCI-S),Nuclear Science & Technology,BY4ZH,,,2026-03-01,WOS:001453270200051,View Full Record in Web of Science
J,"Baghel, YA; Patil, G",,,"Baghel, Yamini A.; Patil, Gunjan",Achanakmar-Amarkantak Biosphere Reserve: Development and traditional knowledge of Baiga,INDIAN JOURNAL OF TRADITIONAL KNOWLEDGE,,English,Article,,,,,,Baiga tribe; Culture and customs; Development schemes; Traditional knowledge,,"An anthropological survey was carried out in the Achanakmar-Amarkantak Biosphere Reserve (AABR) core zone to analyse the impact of government development schemes on tribal culture and indigenous knowledge. For this purpose, three non-rehabilitated villages from the core zone of AABR having maximum Baiga population according to the census 2011 viz., Sarasdol, Tilaidabara and Chhirhatta were selected. The Baiga population of the chosen village was divided into three age groups and interviewed to compare and observe the changes in the traditional culture and customs with time. The data was analysed by comparing the adaptability among the generations. The survey result indicates that indigenous knowledge and tradition have been altered significantly. Due to the influence of outer culture and new technologies introduced in the area through various governmental schemes, the preferences of all generations have shifted towards modern trends. Further, it has resulted in the deterioration of traditional knowledge of the Baiga tribe by introducing facilities. This study has examined the change in the age-old traditional practice of the Baiga tribe of the core zone. The major identified reasons were the interference of the outside culture and the conversational gaps between the two successive generations. The new generation was not ready to adopt their traditional knowledge because they had discovered the ease of life through modern culture. This has resulted in the loss of knowledge of traditional healing techniques and the identification power of various valuable plants that were not passed down to their next generations.","[Baghel, Yamini A.] Indira Gandhi Krishi Vishwavidyalaya, Dept Forestry, Coll Agr, Raipur, Madhya Pradesh, India; [Patil, Gunjan] Guru Ghasidas Vishwavidyalaya, Dept Forestry Wildlife & Environm Sci, Bilaspur, Chhattisgarh, India",Indira Gandhi Krishi Vishwavidyalaya (IGKV); Guru Ghasidas Vishwavidyalaya,"Baghel, YA (corresponding author), Indira Gandhi Krishi Vishwavidyalaya, Dept Forestry, Coll Agr, Raipur, Madhya Pradesh, India.",yamplants@gmail.com,,,,,,11,1,2,0,4,NATL INST SCIENCE COMMUNICATION-NISCAIR,NEW DELHI,"DR K S KRISHNAN MARG, PUSA CAMPUS, NEW DELHI 110 012, INDIA",0972-5938,0975-1068,,INDIAN J TRADIT KNOW,Indian J. Tradit. Knowl.,JUL,2022,21.0,3,,,,704,710,,,,,7,Plant Sciences,Science Citation Index Expanded (SCI-EXPANDED),Plant Sciences,3Q6FT,,,2026-03-01,WOS:000838325200026,View Full Record in Web of Science
J,"Xiao, JH",,,"Xiao, Junhua",Integrating digital literacies and scientific communication in a multimedia anatomy group assignment to advance contextual learning,ANATOMICAL SCIENCES EDUCATION,,English,Review,,,,,,anatomy; assessment; contextual learning; digital; digital literacy; group assignment; multimedia,EDUCATION; ANIMATION; KNOWLEDGE; TOOL,"Anatomists are facing a new generation of learners who will study and work in a technology-rich environment. Indeed, digital technologies are tremendously changing how information and knowledge are communicated and retrieved. However, it remains unclear whether an anatomy assessment can be designed to promote contextual learning through integrating a digital communication strategy. To investigate this, assessment methods were diversified in the first-year neuroanatomy and third-year regional anatomy curricula through implementing a multimedia human anatomy group assignment integrating digital literacies and scientific communication. Through completing this multimedia assignment, students demonstrated their anatomy knowledge transfer using a range of approaches. The main mode of presentations chosen in the two anatomy units were non-animated video presentations (similar to 50%), animated video presentations (similar to 30%), storyboards (similar to 10%), podcasts (similar to 3%), and filmed videos (similar to 3%). A 5-point Likert scale learning and teaching survey was conducted for a total of 195 undergraduate health science students to evaluate students' perception of this group assignment. The majority of students (70-80%) strongly agreed or agreed that the multimedia group assignment helped their teamwork skills. Students who produced animated videos significantly outperformed those who adopted the non-animated presentations during the end-of-semester theory examination (p < 0.05). This study demonstrates that an anatomy group assignment integrating digital literacy and scientific communication is an effective assessment strategy associated with a positive learning experience and outcome. This inquiry-based assignment promotes learning through assessment, allowing students to not only consolidate and extend anatomy knowledge but also developing effective digital communication skills, providing new insights into non-didactic anatomy assessments.","[Xiao, Junhua] Swinburne Univ Technol, Sch Hlth Sci, Dept Hlth Sci & Biostat, Hawthorn, Vic, Australia; [Xiao, Junhua] Swinburne Univ Technol, Sch Hlth Sci, Dept Hlth Sci & Biostat, John St, Hawthorn, Vic 3022, Australia",Swinburne University of Technology; Swinburne University of Technology,"Xiao, JH (corresponding author), Swinburne Univ Technol, Sch Hlth Sci, Dept Hlth Sci & Biostat, John St, Hawthorn, Vic 3022, Australia.",jxiao@swin.edu.au,"Xiao, Junhua/AAC-6898-2022","Xiao, Junhua/0000-0002-4320-2855","Swinburne University of Technology; Teaching Excellence Award from The School of Health Sciences, Swinburne University of Technology; Swinburne University of Technology, as part of the Wiley - Swinburne University of Technology agreement via the Council of Australian University Librarians","Swinburne University of Technology; Teaching Excellence Award from The School of Health Sciences, Swinburne University of Technology; Swinburne University of Technology, as part of the Wiley - Swinburne University of Technology agreement via the Council of Australian University Librarians","We would like to thank Ms. Sharmeen Adnan and Mr. Patrick Michael for assisting in the delivery of the multimedia group assignment presentation and the survey. This work was supported by the Teaching Excellence Award from The School of Health Sciences, Swinburne University of Technology to JX. Open access publishing facilitated by Swinburne University of Technology, as part of the Wiley - Swinburne University of Technology agreement via the Council of Australian University Librarians.",35,4,5,3,21,WILEY,HOBOKEN,"111 RIVER ST, HOBOKEN 07030-5774, NJ USA",1935-9772,1935-9780,,ANAT SCI EDUC,Anat. Sci. Educ.,JAN,2024,17.0,1,,,,55,65,,10.1002/ase.2331,http://dx.doi.org/10.1002/ase.2331,AUG 2023,11,"Education, Scientific Disciplines",Science Citation Index Expanded (SCI-EXPANDED),Education & Educational Research,EK2B6,37614080.0,hybrid,2026-03-01,WOS:001153616900001,View Full Record in Web of Science
J,"Yin, SC; Kasraian, D; van Wesemael, P",,,"Yin, Shengchen; Kasraian, Dena; van Wesemael, Pieter",Children's perception of urban green infrastructure and nature-related digital tools,JOURNAL OF ENVIRONMENTAL PSYCHOLOGY,,English,Article,,,,,,Children; Urban green infrastructure; Perception; Connection to nature; Nature-related digital tools; Case study,CONNECTION; AGE; SATISFACTION; TECHNOLOGY; BEHAVIOR; PARENTS,"Urban green infrastructure (UGI) is an interconnected green network of multifunctional ecological systems in or around urban areas, playing a vital role in children's physical and cognitive development. Children's reduced interaction with UGI is partly attributed to their growing reliance on digital technology, yet digital interventions could positively influence this interaction. However, the influence of digital technology on children's perceptions of UGI remains understudied. This study aims to identify facilitators and barriers to children-nature interaction from their perspectives, examine the determinants of children's perception of connection to nature, and explore their perception of the UGI depending on their age, gender, and the presence or absence of a nature-related digital tool. A total of 153 children aged 8-12 and 109 parents participated in this study in Apeldoorn, the Netherlands. Children explored a UGI route using either a GPS-based application, or a guide and a map. Children identified playing with peers and families as a facilitator of their interaction with nature and the use of digital tools as a barrier. The results show that children's perception of connection to nature is higher among girls, and positively correlates with their parents' perception of connection to nature and attitudes towards its benefits. Children's perception of connection to nature increases after a nature-related activity across all groups, with boys and older children showing greater improvement. For knowledge transfer and creating an engaging environment, a knowledgeable and enthusiastic tour guide still outperforms a digital tool. Our findings provide insights for urban designers, policy makers, and digital intervention developers to create child-friendly UGIs and digital technologies that enhance interaction with it.","[Yin, Shengchen; Kasraian, Dena; van Wesemael, Pieter] Eindhoven Univ Technol, Dept Built Environm, POB 513,Groene Loper 6,Vertigo 8, NL-5600 MB Eindhoven, Netherlands",Eindhoven University of Technology,"Yin, SC (corresponding author), Eindhoven Univ Technol, Dept Built Environm, POB 513,Groene Loper 6,Vertigo 8, NL-5600 MB Eindhoven, Netherlands.",s.yin@tue.nl,"; Yin, Shengchen/MZR-5672-2025","Kasraian, Dena/0000-0001-5253-0669; Yin, Shengchen/0009-0007-1475-6588",China Scholarship Council,China Scholarship Council(China Scholarship Council),This work was supported by the China Scholarship Council. We would like to thank the China Scholarship Council for providing the funding.,79,0,0,9,17,ACADEMIC PRESS LTD- ELSEVIER SCIENCE LTD,LONDON,"24-28 OVAL RD, LONDON NW1 7DX, ENGLAND",0272-4944,1522-9610,,J ENVIRON PSYCHOL,J. Environ. Psychol.,MAY,2025,103.0,,,,,,,102565,10.1016/j.jenvp.2025.102565,http://dx.doi.org/10.1016/j.jenvp.2025.102565,APR 2025,16,"Environmental Studies; Psychology, Multidisciplinary",Social Science Citation Index (SSCI),Environmental Sciences & Ecology; Psychology,1GQ2B,,hybrid,2026-03-01,WOS:001464562100001,View Full Record in Web of Science
J,"Li, X; Wang, Y",,,"Li, Xin; Wang, Yan",A novel integrated approach for quantifying the convergence of disruptive technologies from science to technology,TECHNOLOGICAL FORECASTING AND SOCIAL CHANGE,,English,Article,,,,,,Disruptive technology; Technology convergence; Knowledge convergence; Knowledge meme; Smartphone technology,KNOWLEDGE; CITATION; IDENTIFICATION; PUBLICATIONS; INNOVATION; NETWORKS; DYNAMICS; PATTERNS; LINKAGE; MEMES,"With rapid developments in science and technology, knowledge transfer from science to technology and technology convergence from different fields are accelerating. Technology convergence has become a main source of disruptive technologies (DTs). To facilitate enterprise R&D strategic decision-making and government innovation policies formulation, it is necessary to quantify the convergence processes of DTs and understand the DTs' emergence characteristics from science to technology. Existing research on technology convergence measurement mainly used patent citation information, patent co-classification analysis, and text mining. However, since these studies have limited analysis of the sources and causes of technology convergence from the perspective of knowledge memes, resulting in insufficient revelation of the processes and characteristics of DTs' emergence. Knowledge meme theory helps to reveal the relationships between knowledge diffusion, knowledge convergence, and technology convergence. Therefore, in this paper, we proposed a research framework for quantifying the convergence of DTs from science to technology. In this framework, we analyzed the knowledge diffusion and technology convergence of DTs from science to technology based on knowledge meme theory. We also integrated patent citation analysis, text mining, and cascade network models to quantitatively measure knowledge diffusion and technology convergence characteristics. We tried to understand the generation mechanisms of DTs from the perspective of technology convergence. We took smartphones as a case study to verify the framework's validity and flexibility. This paper provides a novel approach for quantifying the convergence of DTs from science to technology, which can help us to understand the emergence and development trends of DTs. This paper will also be of interest to smartphone technology R&D experts.","[Li, Xin; Wang, Yan] Beijing Univ Technol, Coll Econ & Management, Beijing, Peoples R China",Beijing University of Technology,"Li, X; Wang, Y (corresponding author), Beijing Univ Technol, Coll Econ & Management, Beijing, Peoples R China.",lixinyz@bjut.edu.cn; wangy_2c@163.com,,,National Natural Science Foundation of China [72174017],National Natural Science Foundation of China(National Natural Science Foundation of China (NSFC)),Acknowledgments This paper is supported by the National Natural Science Foundation of China (Grant 72174017) . We are also grateful to the three anonymous reviewers for their valuable comments.,70,5,5,64,210,ELSEVIER SCIENCE INC,NEW YORK,"STE 800, 230 PARK AVE, NEW YORK, NY 10169 USA",0040-1625,1873-5509,,TECHNOL FORECAST SOC,Technol. Forecast. Soc. Chang.,DEC,2024,209.0,,,,,,,123825,10.1016/j.techfore.2024.123825,http://dx.doi.org/10.1016/j.techfore.2024.123825,OCT 2024,23,Business; Regional & Urban Planning,Social Science Citation Index (SSCI),Business & Economics; Public Administration,K2U8I,,,2026-03-01,WOS:001342488300001,View Full Record in Web of Science
J,"Baik, A",,,"Baik, Ahmad","A Comprehensive Heritage BIM Methodology for Digital Modelling and Conservation of Built Heritage: Application to Ghiqa Historical Market, Saudi Arabia",REMOTE SENSING,,English,Article,,,,,,HBIM; 3D laser scanning; historical architecture; documentation; conservation; Ghiqa Historical Market; Saudi Arabia; cultural heritage,,"Preserving historical architectural structures is crucial for safeguarding cultural heritage. This study explores the application of Heritage Building Information Modelling (HBIM) to enhance the documentation process of the Ghiqa Historical Market in Saudi Arabia, a monument known for its intricate architecture and cultural significance. Traditional documentation methods often fail to capture detailed features accurately and rely on labour-intensive manual processes. HBIM uses advanced digital technologies to improve precision, efficiency, and preservation efforts. In this study, point cloud data from 3D laser scanning is used to create a detailed digital model of the market, covering structural systems, material attributes, architectural features, and historical context. The research also integrates historical archives and photographs to enrich the model with additional contextual information. This comprehensive approach provides a holistic understanding of the Ghiqa Historical Market, aiding accurate preservation and restoration decisions. HBIM offers several advantages in architectural documentation. The digital model enhances visualization, allowing stakeholders to explore the site from multiple perspectives. It also serves as a tool for analysing structural integrity, identifying potential risks, and planning restoration interventions. Moreover, digital documentation ensures effective knowledge transfer across generations, preserving valuable architectural heritage for future reference and research. Additionally, it promotes interdisciplinary collaboration among architects, historians, conservators, and other stakeholders involved in preservation. Including the Ghiqa Historical Market in the UNESCO World Heritage List would highlight its global significance, attracting international attention and resources for its preservation. This designation would underscore the market's cultural and historical importance, fostering a sense of pride and responsibility in its maintenance. The implementation of Heritage BIM demonstrates its potential to revolutionize heritage conservation by combining diverse data sources into a single, detailed, and accessible digital resource.","[Baik, Ahmad] King Abdulaziz Univ, Architecture & Planning Fac, Geomat Dept, Jeddah 21589, Saudi Arabia",King Abdulaziz University,"Baik, A (corresponding author), King Abdulaziz Univ, Architecture & Planning Fac, Geomat Dept, Jeddah 21589, Saudi Arabia.",abaik@kau.edu.sa,"Baik, Ahmad/AAY-2388-2020","Baik, Ahmad/0000-0002-1049-8653","Ministry of Education and King Abdulaziz University, DSR, Jeddah,Saudi Arabia [GPIP:264-137-2024]","Ministry of Education and King Abdulaziz University, DSR, Jeddah,Saudi Arabia(King Abdulaziz University)","This research work was funded by Institutional Fund Projects under Grant No. GPIP:264-137-2024 provided by the Ministry of Education and King Abdulaziz University, DSR, Jeddah,Saudi Arabia.",42,11,13,11,67,MDPI,BASEL,"ST ALBAN-ANLAGE 66, CH-4052 BASEL, SWITZERLAND",,2072-4292,,REMOTE SENS-BASEL,Remote Sens.,AUG,2024,16.0,15,,,,,,2833,10.3390/rs16152833,http://dx.doi.org/10.3390/rs16152833,,29,"Environmental Sciences; Geosciences, Multidisciplinary; Remote Sensing; Imaging Science & Photographic Technology",Science Citation Index Expanded (SCI-EXPANDED),Environmental Sciences & Ecology; Geology; Remote Sensing; Imaging Science & Photographic Technology,C1M2J,,"Green Submitted, gold",2026-03-01,WOS:001287065100001,View Full Record in Web of Science
