109,"Barrett, Alex1    ; Zhang, Nuodi1    ; Wei, Shiyao1    1 Florida State University, College of Education, Health, and Human Sciences, Tallahassee, FL, US abarrett3@fsu.edu; nzhang4@fsu.edu; sw22b@fsu.edu","Barrett, Alex; Zhang, Nuodi; Wei, Shiyao.",//ezproxy.lb.polyu.edu.hk/login?url=https://www.proquest.com/scholarly-journals/virtual-reality-your-head-how-immersion-mental/docview/3163848651/se-2?accountid=16210,"Immersive learning is predominantly constrained to technology-based interventions but has the potential for more diverse applications. This study reports on an experiment investigating the learning affordances of psychological immersion evoked by narrative absorption. A total of 228 participants were randomly assigned to one of three forms of media, an image, a word list, and a narrative, all of which contained identical items to be memorized for immediate and delayed free recall memory tests. Other variables measured were immersion, extraneous cognitive load, and mental imagery. ANOVA and correlation analyses showed that the narrative media was found to be significantly more immersive and that it evoked mental imagery in individuals at higher levels than both the list and image media. Importantly, there was more decay in memory recall between immediate and delayed tests for those exposed to the list and the image than for those who read the narrative. This implies the utility of immersive narratives for spontaneous mental image generation, which leads to improved knowledge retention. Other implications for immersive learning theory are discussed, and practical solutions for incorporating narrative immersion in learning are also suggested. (PsycInfo Database Record (c) 2025 APA, all rights reserved) (Source: journal abstract)",https://julac-hkpu.primo.exlibrisgroup.com/openurl/852JULAC_HKPU/852JULAC_HKPU:HKPU?sid=proquest&amp;auinit=Alex&amp;aulast=Barrett&amp;atitle=The+virtual+reality+in+your+head%3A+How+immersion+and+mental+imagery+are+connected+to+knowledge+retention&amp;stitle=Educational+Psychology+Review&amp;btitle=&amp;id=doi:10.1007%2Fs10648-025-09984-4&amp;title=The+virtual+reality+in+your+head%3A+How+immersion+and+mental+imagery+are+connected+to+knowledge+retention&amp;volume=37&amp;issue=1&amp;date=2025&amp;spage=9&amp;isbn=&amp;genre=article&amp;,//julac-hkpu.primo.exlibrisgroup.com/openurl/852JULAC_HKPU/852JULAC_HKPU:HKPU?sid=proquest&amp;auinit=Alex&amp;aulast=Barrett&amp;atitle=The+virtual+reality+in+your+head%3A+How+immersion+and+mental+imagery+are+connected+to+knowledge+retention&amp;stitle=Educational+Psychology+Review&amp;btitle=&amp;id=doi:10.1007%2Fs10648-025-09984-4&amp;title=The+virtual+reality+in+your+head%3A+How+immersion+and+mental+imagery+are+connected+to+knowledge+retention&amp;volume=37&amp;issue=1&amp;date=2025&amp;spage=9&amp;isbn=&amp;genre=article&amp;,Not available.,The Virtual Reality In Your Head: How Immersion And Mental Imagery Are Connected To Knowledge Retention,Empty,Educational Psychology Review,Educ Psychol Rev,24-Jan-25,Germany,1573-336X,Empty,Empty,Engl ish,Empty,1/24/2025,Empty,24-Jan-25,Empty,Empty,https://doi.org/10.1007/s10648-025-09984-4,Empty,Empty,Empty,3163848651,http://ezproxy.lb.polyu.edu.hk/login?url=https://www.proquest.com/scholarly-journals/virtual-reality-your-head-how-immersion-mental/docview/3163848651/se- 2?accountid=16210,"© 2025, The Author(s), under exclusive licence to Springer Science+Business Media, LLC, part of Springer Nature. Springer Nature or its licensor (e.g. a society or other partner) holds exclusive rights to this article under a publishing agreement with the author(s) or other rightsholder(s); author self-archiving of the accepted manuscript version of this article is solely governed by the terms of such publishing agreement and applicable law.",,APA PsycInfo®,Human Channel Capacity (major); Imagery (major); Knowledge Level (major); Learning (major); Memory (major); Narratives (major); Psychology (major); Virtual Reality (major),3500: Educational & School Psychology,Adulthood (18 yrs & older); Young Adulthood (18-29 yrs); Thirties (30-39 yrs); Middle Age (40-64 yrs),Human; Male; Female,virtual reality; learning affordances; immersion; psychological immersion; immersive learning; mental imagery; knowledge retention; narratives; narrative absorption memory recall; cognitive load; delayed memory,"Empirical Study, Quantitative Study",Empty,37,1,Electronic,Springer (Germany),Empty,1040-726X,Empty,"Journal, Peer Reviewed Journal, Journal Article",06 Feb 2025 (PsycINFO),2025-74465-001,Empty,9,Empty,Empty,Empty,Empty,Empty,Empty,abarrett3@fsu.edu; nzhang4@fsu.edu; sw22b@fsu.edu,3-Jan-25,Empty,Empty,Empty,Test name: Free-Recall Memory Test,"Barrett, Alex, Florida State University, College of Education, Health, and Human Sciences, Stone Building, 1114 W. Call Street, Tallahassee, 32306, US, abarrett3@fsu.edu",Empty,Empty,91,Empty,Empty,Empty,Empty,Empty,Empty,Empty,Empty,Empty,Empty,Empty,Empty,Empty,Empty,Empty,Empty,Empty,Empty,Empty,Empty,Empty,Empty,Empty,Empty,Empty,Empty,Empty,Empty,Empty,Empty,Empty,Empty,Empty,Empty,Empty,Empty,Empty,Empty,Empty,Empty,Empty
110,"Bradford, Renée L.","Bradford, Renée L.",//ezproxy.lb.polyu.edu.hk/login?url=https://www.proquest.com/dissertations-theses/building-digital-altar-justice-centered-torch/docview/3294944330/se-2?accountid=16210,"This mixed-methods study aimed to identify factors critical in building a digital support network employing contemplative practices to support activists engaging in racial justice work in the United States. The research question that guided this study was: What factors do racial justice activists regard as critical in building a digital support network employing contemplative practices? The study?s importance lies in addressing the evolving landscape of digital activism while honoring the spiritual and relational foundations that have historically sustained social justice movements, particularly as contemporary activists navigate new technological tools while seeking to maintain authentic connection and contemplative grounding. Key findings revealed that activists prioritize relational elements over technological infrastructure, with clear communication channels ranking as the most critical factor, followed by accessibility and inclusivity, trust, and mutual support. The study identified nine major themes across focus groups, which emphasized that relational trust serves as the engine of sustainable activism, digital tools must serve the work rather than becoming barriers, and contemplative practices cultivate integrity for sustained justice work. Additional findings highlighted the importance of intergenerational knowledge transfer, representation, and safety in digital spaces, as well as the need for digital networks to function as containers of cultivation that pair online accessibility with embodied presence, creating healing spaces that honor both technological innovation and ancestral wisdom. This dissertation is available in open access at AURA (http://aura.antioch.edu) and the OhioLINK ETD Center (https://etd.ohiolink.edu/).",https://julac-hkpu.primo.exlibrisgroup.com/openurl/852JULAC_HKPU/852JULAC_HKPU:HKPU?sid=proquest&amp;auinit=Ren%C3%A9e&amp;aulast=Bradford&amp;atitle=&amp;stitle=&amp;btitle=&amp;id=doi:&amp;title=Building+a+Digital+Altar+for+the+Justice-Centered+Torch-Bearers%3A+The+Role+of+Digital+Networks+in+Supporting+Contemporary+Racial+Justice+Activists+Through+Contemplative+Practices&amp;volume=&amp;issue=&amp;date=2025&amp;spage=&amp;isbn=9798273329973&amp;genre=dissertations&amp;,//julac-hkpu.primo.exlibrisgroup.com/openurl/852JULAC_HKPU/852JULAC_HKPU:HKPU?sid=proquest&amp;auinit=Ren%C3%A9e&amp;aulast=Bradford&amp;atitle=&amp;stitle=&amp;btitle=&amp;id=doi:&amp;title=Building+a+Digital+Altar+for+the+Justice-Centered+Torch-Bearers%3A+The+Role+of+Digital+Networks+in+Supporting+Contemporary+Racial+Justice+Activists+Through+Contemplative+Practices&amp;volume=&amp;issue=&amp;date=2025&amp;spage=&amp;isbn=9798273329973&amp;genre=dissertations&amp;,Not available.,Building A Digital Altar For The Justice-Centered Torch-Bearers: The Role Of Digital Networks In Supporting Contemporary Racial Justice Activists Through Contemplative Practices,Empty,Empty,Empty,2025,Empty,Empty,Dissertation or Thesis,Empty,English,Empty,Empty,Empty,Empty,Empty,Empty,Empty,Empty,Empty,Empty,3294944330,http://ezproxy.lb.polyu.edu.hk/login?url=https://www.proquest.com/dissertations-theses/building-digital-altar-justice-centered-torch/docview/3294944330/se-2?accountid=16210,Database copyright ProQuest LLC; ProQuest does not claim copyright in the individual underlying works.,,"ProQuest Dissertations & Theses Global A & I: The Humanities and Social Sciences Collection,ProQuest Dissertations & Theses Global,ProQuest Dissertations & Theses Global: The Sciences and Engineering Collection",Information technology; Peace studies; Social research; Political science,0344: Social research; 0489: Information Technology; 0563: Peace Studies; 0615: Political science,Empty,Empty,Civil rights leaders; Civil Rights Movement; Contemplative action; Digital kinship; Digital spaces; Leadership,Empty,Empty,Empty,Empty,Empty,Empty,9798273329973,Empty,Empty,Dissertation/Thesis,Empty,Empty,Empty,Empty,Empty,Empty,Empty,Empty,Empty,Empty,Empty,Empty,Empty,272,Empty,Empty,Empty,Empty,Empty,Empty,Empty,Empty,Empty,"DAI-A 87/7(E), Dissertation Abstracts International",Antioch University,Empty,Empty,Empty,2025,1216,"Tirmizi, S. Aqeel","Essed, Philomena; Kumar, Neha",Leadership and Change,United States -- Ohio,Ph.D.,32488568,Empty,Empty,Empty,Empty,Empty,Empty,Empty,Empty,Empty,Empty,Empty,Empty,Empty,Empty,Empty,Empty,Empty,Empty,Empty,Empty,Empty,Empty,Empty,Empty,Empty
111,"Fleming, Berlisher M.","Fleming, Berlisher M.",//ezproxy.lb.polyu.edu.hk/login?url=https://www.proquest.com/dissertations-theses/case-study-millennial-nurses-experiences/docview/3281893210/se-2?accountid=16210,"Millennial nurses are quickly becoming the largest generation in the nursing field, next to the baby boomers. As boomers retire, millennials are predicted to become the majority within the next 5 years. There is a lack of attention on the millennials’ experiences, skills transfer, policies to protect them, and training to prevent negative stereotyping from boomers. The purpose of this study was to gain a better understanding of millennial nurses’ experiences as they collaborate with baby boomer nurses in medical treatment settings. A descriptive qualitative case study methodology was used. There are numerous studies on baby boomers’ experiences as they lead or work with millennials. Still, there are very few studies from the millennials’ perspectives, and only a few on the generational workplace in the nursing field. Eight female participants were selected for the study—four Black, two Hispanic, and two White participants from seven states in the United States. Six themes emerged from the data that described the millennial nurses’ experiences of collaborating with baby boomers: boomers’ resistance to change, reverse ageism toward millennials, minimal knowledge transfer, boomers’ lack of technical skills, boomers’ uncollaborative behavior, and millennials' seeking alternative career opportunities. The study data demonstrated that millennials are eager to collaborate and learn from boomer nurses, despite the perception that the older, more experienced nurses are unwilling to teach them, and millennials desire to be respected for the skills they bring to the field, namely, technology. Collaboration and understanding can be accomplished between the two groups through role-playing in group training, generational and reverse mentoring, and new policies to protect millennial nurses, ensure skills transfer, and improve patient care. The findings of the study could help industrial/organization professionals develop training and policies to increase job satisfaction across generations and enhance retention and efficiency in the medical industry.",https://julac-hkpu.primo.exlibrisgroup.com/openurl/852JULAC_HKPU/852JULAC_HKPU:HKPU?sid=proquest&amp;auinit=Berlisher&amp;aulast=Fleming&amp;atitle=&amp;stitle=&amp;btitle=&amp;id=doi:&amp;title=A+Case+Study+of+Millennial+Nurses%27+Experiences+Collaborating+with+Baby+Boomer+Personnel+in+a+Medical+Treatment+Setting&amp;volume=&amp;issue=&amp;date=2025&amp;spage=&amp;isbn=9798270204648&amp;genre=dissertations&amp;,//julac-hkpu.primo.exlibrisgroup.com/openurl/852JULAC_HKPU/852JULAC_HKPU:HKPU?sid=proquest&amp;auinit=Berlisher&amp;aulast=Fleming&amp;atitle=&amp;stitle=&amp;btitle=&amp;id=doi:&amp;title=A+Case+Study+of+Millennial+Nurses%27+Experiences+Collaborating+with+Baby+Boomer+Personnel+in+a+Medical+Treatment+Setting&amp;volume=&amp;issue=&amp;date=2025&amp;spage=&amp;isbn=9798270204648&amp;genre=dissertations&amp;,Not available.,A Case Study Of Millennial Nurses' Experiences Collaborating With Baby Boomer Personnel In A Medical Treatment Setting,Empty,Empty,Empty,2025,Empty,Empty,Dissertation or Thesis,Empty,English,Empty,Empty,Empty,Empty,Empty,Empty,Empty,Empty,Empty,Empty,3281893210,http://ezproxy.lb.polyu.edu.hk/login?url=https://www.proquest.com/dissertations-theses/case-study-millennial-nurses-experiences/docview/3281893210/se-2?accountid=16210,Database copyright ProQuest LLC; ProQuest does not claim copyright in the individual underlying works.,,"Publicly Available Content Database,ProQuest Dissertations & Theses Global A & I: The Humanities and Social Sciences Collection,ProQuest Dissertations & Theses Global,ProQuest Dissertations & Theses Global: The Sciences and Engineering Collection",Management; Organizational behavior; Health care management,0703: Organizational behavior; 0769: Health care management; 0454: Management,Empty,Empty,Generational workplace; Knowledge transfer; Millennial nurses; Retention; Reverse ageism; Workplace collaboration,Empty,Empty,Empty,Empty,Empty,Empty,9798270204648,Empty,Empty,Dissertation/Thesis,Empty,Empty,Subject: Management Organizational behavior Health care management,Empty,Empty,Empty,Empty,Empty,Empty,Empty,Empty,Empty,Empty,134,Empty,Empty,Empty,Empty,Empty,Empty,Empty,Empty,Empty,"DAI-A 87/6(E), Dissertation Abstracts International",Capella University,Empty,Empty,Empty,2025,1351,"Welch, Deborah   Frese, Kent","Santonastasi, Antonio",School of Social and Behavioral Sciences,United States -- Minnesota,Ph.D.,32400086,Empty,Empty,Empty,Empty,Empty,Empty,Empty,Empty,Empty,Empty,Empty,Empty,Empty,Empty,Empty,Empty,Empty,Empty,Empty,Empty,Empty,Empty,Empty,Empty,Empty
112,"Wasnik, Harsh Homdeo1; Shrivastava, Tushar11 University of Arizona,Tucson,Arizona,USA","Wasnik, Harsh Homdeo; Shrivastava, Tushar.",//ezproxy.lb.polyu.edu.hk/login?url=https://www.proquest.com/conference-papers-proceedings/adaptive-machine-learning-frameworks-integrating/docview/3263936353/se-2?accountid=16210,"Conference Title: 2025 8th International Conference on Circuit, Power & Computing Technologies (ICCPCT) Conference Start Date: 2025 Aug. 7 Conference End Date: 2025 Aug. 8 Conference Location: Kollam, India Recent advancements in artificial intelligence have paved the way for innovative personalized education through Interactive Machine Learning Systems (IMLS). This study explores how combining large language models (LLMs) with knowledge graphs (KGs) within IMLS can create adaptive, customized learning experiences. Leveraging the sophisticated natural language understanding and generation capabilities of LLMs, the system enables dynamic interactions between learners and educational content, offering real-time feedback and personalized guidance. At the same time, knowledge graphs provide a well-organized framework for structuring educational materials, detailing the relationships among concepts, skills, and learner profiles. By integrating these technologies, the system can intelligently assess individual learner needs, predict learning trajectories, and tailor instructional strategies accordingly. Empirical evaluations across various educational settings have shown significant enhancements in learner engagement, knowledge retention, and overall academic performance. This research highlights the promising potential of merging advanced language models with semantic knowledge representations to develop scalable and effective personalized education solutions that cater to the unique needs of every learner. This study addresses the existing gap in combining large language models and knowledge graphs for personalized education by proposing a novel integrated framework. Our empirical results demonstrate significant improvements in learner engagement and knowledge retention, highlighting the robustness and scalability of the approach.",https://julac-hkpu.primo.exlibrisgroup.com/openurl/852JULAC_HKPU/852JULAC_HKPU:HKPU?sid=proquest&amp;auinit=Harsh&amp;aulast=Wasnik&amp;atitle=Adaptive+Machine+Learning+Frameworks+Integrating+LLMs+and+Knowledge+Graphs+for+Tailored+Education&amp;stitle=The+Institute+of+Electrical+and+Electronics+Engineers%2C+Inc.+%28IEEE%29+Conference+Proceedings&amp;btitle=&amp;id=doi:10.1109%2FICCPCT65132.2025.11176710&amp;title=Adaptive+Machine+Learning+Frameworks+Integrating+LLMs+and+Knowledge+Graphs+for+Tailored+Education&amp;volume=&amp;issue=&amp;date=2025&amp;spage=1509&amp;isbn=&amp;genre=proceeding&amp;,//julac-hkpu.primo.exlibrisgroup.com/openurl/852JULAC_HKPU/852JULAC_HKPU:HKPU?sid=proquest&amp;auinit=Harsh&amp;aulast=Wasnik&amp;atitle=Adaptive+Machine+Learning+Frameworks+Integrating+LLMs+and+Knowledge+Graphs+for+Tailored+Education&amp;stitle=The+Institute+of+Electrical+and+Electronics+Engineers%2C+Inc.+%28IEEE%29+Conference+Proceedings&amp;btitle=&amp;id=doi:10.1109%2FICCPCT65132.2025.11176710&amp;title=Adaptive+Machine+Learning+Frameworks+Integrating+LLMs+and+Knowledge+Graphs+for+Tailored+Education&amp;volume=&amp;issue=&amp;date=2025&amp;spage=1509&amp;isbn=&amp;genre=proceeding&amp;,Not available.,Adaptive Machine Learning Frameworks Integrating Llms And Knowledge Graphs For Tailored Education,Empty,"The Institute of Electrical and Electronics Engineers, Inc. (IEEE) Conference Proceedings; Piscataway",Empty,2025,United States,Empty,Conference Paper,Empty,English,Empty,10/20/2025,Empty,20-Oct-25,Empty,Empty,https://doi.org/10.1109/ICCPCT65132.2025.11176710,Empty,Empty,Empty,3263936353,http://ezproxy.lb.polyu.edu.hk/login?url=https://www.proquest.com/conference-papers-proceedings/adaptive-machine-learning-frameworks-integrating/docview/3263936353/se-2?accountid=16210,"Copyright The Institute of Electrical and Electronics Engineers, Inc. (IEEE) 2025",,"ProQuest One Sustainability,ProQuest One Applied & Life Sciences,SciTech Premium Collection",Machine learning; Graphs; Large language models; Artificial intelligence; Education; Retention; Real time; Knowledge representation; Customization; Interactive systems; Speech recognition,Empty,Empty,Empty,Adaptive learning; Large language models; Scalability; Semantics; Knowledge graphs; Robustness; Real-time systems; Natural language processing; Trajectory; Standards; Personalized education; Interactive machine learning systems; Large language models; Knowledge graphs; Adaptive learning; Semantic knowledge representation,Empty,Empty,Empty,Empty,Empty,"The Institute of Electrical and Electronics Engineers, Inc. (IEEE)",Empty,Empty,Empty,Conference Proceedings,Empty,Empty,Subject: Machine learning Artificial intelligence,1509-1514,Piscataway,Engineering--Electrical Engineering,Empty,Empty,Empty,Empty,Empty,Empty,Empty,6,Empty,Empty,Empty,Empty,Empty,Empty,Economic,Empty,Empty,Empty,Empty,Empty,Empty,Empty,Empty,Empty,Empty,Empty,Empty,Empty,Empty,Empty,Empty,Empty,Empty,Empty,Empty,Empty,Empty,Empty,Empty,Empty,Empty,Empty,Empty,Empty,Empty,Empty,Empty,Empty,Empty,Empty,Empty,Empty,Empty,Empty,Empty
113,"Zheng, Haolan","Zheng, Haolan.",//ezproxy.lb.polyu.edu.hk/login?url=https://www.proquest.com/dissertations-theses/training-development-learning-facilitation-lower/docview/3258896717/se-2?accountid=16210,"The adoption of Adaptive Cruise Control (ACC) and other Advanced Driver Assistance Systems (ADAS) introduces benefits and challenges for drivers. Drivers who use those driving technologies should develop accurate mental models, appropriately calibrate trust, and effectively apply automation in real-world scenarios. This dissertation examines how different text-based training influence drivers’ learning, engagement, and training transfer when using ACC, with a focus on both younger and older adults. A series of driving simulator studies compared several training conditions with or without different types of driving roles and responsibilities information. The study assessed how these training methods impact drivers’ comprehension, trust, and performance in edge-case driving scenarios. Results suggest that training presentation and structure significantly influences learning and transfer outcomes. Older participants, in particular, exhibited increased attention to system limitations, and scaffolding training content improved knowledge retention and application. These findings highlight the importance of structuring driver education programs to support better mental model development and trust calibration, ultimately enhancing the safe and effective use of ACC.",https://julac-hkpu.primo.exlibrisgroup.com/openurl/852JULAC_HKPU/852JULAC_HKPU:HKPU?sid=proquest&amp;auinit=Haolan&amp;aulast=Zheng&amp;atitle=&amp;stitle=&amp;btitle=&amp;id=doi:&amp;title=Training+Development+and+Learning+Facilitation+for+Lower-Level+Automated+Driving+Systems+Across+Age+Groups&amp;volume=&amp;issue=&amp;date=2025&amp;spage=&amp;isbn=9798297611207&amp;genre=dissertations&amp;,//julac-hkpu.primo.exlibrisgroup.com/openurl/852JULAC_HKPU/852JULAC_HKPU:HKPU?sid=proquest&amp;auinit=Haolan&amp;aulast=Zheng&amp;atitle=&amp;stitle=&amp;btitle=&amp;id=doi:&amp;title=Training+Development+and+Learning+Facilitation+for+Lower-Level+Automated+Driving+Systems+Across+Age+Groups&amp;volume=&amp;issue=&amp;date=2025&amp;spage=&amp;isbn=9798297611207&amp;genre=dissertations&amp;,Not available.,Training Development And Learning Facilitation For Lower-Level Automated Driving Systems Across Age Groups,Empty,Empty,Empty,2025,Empty,Empty,Dissertation or Thesis,Empty,English,Empty,Empty,Empty,Empty,Empty,Empty,Empty,Empty,Empty,Empty,3258896717,http://ezproxy.lb.polyu.edu.hk/login?url=https://www.proquest.com/dissertations-theses/training-development-learning-facilitation-lower/docview/3258896717/se-2?accountid=16210,Database copyright ProQuest LLC; ProQuest does not claim copyright in the individual underlying works.,,"ProQuest Dissertations & Theses Global,ProQuest Dissertations & Theses Global: The Sciences and Engineering Collection",Industrial engineering; Engineering; Systems science,0546: Industrial engineering; 0537: Engineering; 0790: Systems science,Empty,Empty,Adaptive Cruise Control; Automation training; Driver responsibility; Scaffolding; Younger and older drivers,Empty,Empty,Empty,Empty,Empty,Empty,9798297611207,Empty,Empty,Dissertation/Thesis,Empty,Empty,Empty,Empty,Empty,Empty,Empty,Empty,Empty,Empty,Empty,Empty,Empty,255,Empty,Empty,Empty,Empty,Empty,Empty,Empty,Empty,Empty,"DAI-B 87/4(E), Dissertation Abstracts International",University of Florida,Empty,Empty,Empty,2025,0070,"Giang, Wayne Chi Wei","Hu, Boyi; Kim, Minhee; Classen, Sherrilene",Industrial and Systems Engineering,United States -- Florida,Ph.D.,32039165,Empty,Empty,Empty,Empty,Empty,Empty,Empty,Empty,Empty,Empty,Empty,Empty,Empty,Empty,Empty,Empty,Empty,Empty,Empty,Empty,Empty,Empty,Empty,Empty,Empty
