,Author,Publication info,http,Abstract,Links,https,Full text,Title,Correspondence author,Publication title,Journal abbreviation,Publication year,Country of publication,eISSN,Source type,Format availability,Language of publication,Record type,Online publication date,Publication note,First posting date,Revised date,First submitted date,DOI Link,Medline document status,Electronic publication date,PubMed ID,ProQuest document ID,Document URL,Copyright,Last updated,Database,Subject,Classification,Age,Population,Keywords,Methodology,Physical description,Volume,Issue,Format covered,Publisher,ISBN,ISSN,Dissertation details,Document type,Release date,Accession number,Business indexing term,Pages,Place of publication,Publication subject,e-ISSN,Milestone dates,MeSH subject,Supplemental data,Author e-mail address,Accepted date,First page,Number of pages,Location,Test and measure,Contact individual,Grant/sponsorship,Other publisher,Number of references,Sustainability pillar,URL,Section,Source,University/institution,Full text outside of ProQuest,ERIC Subject,Objective,Degree date,School code,Advisor,Committee member,Department,University location,Degree,Dissertation/thesis number,Alternate title,Source details,Company / organization,Sponsor,Grant,Correction date,How to cite this article,Research method,Go to Library Record,"10. Alamoudi, A. Ghayqah",Author Contributions A.D.,Note,Information provider,[IMAGE OMITTED,Notes,- The digital divide,- Digital health literacy,Ageing,The digital age,"Norman CD, Skinner HA. eHEALS",Grey Literature Report. 2021. URL,Google Docs. Facebook. URL,"[1] A. Ligeza, ""Artificial intelligence","[4] F. Chollet, ""Xception",Editor
0,"Sharma, Aprajita1; Pandey, Saumya1; Singh, Sharda2; Ghatak, Indrani21 Management Student, Human Resource Management Program, Xavier Institute of Social Service, Ranchi, Jharkhand, India2 Assistant Professor, Human Resource Management Program, Xavier Institute of Social Service, Ranchi, Jharkhand, India","Sharma, Aprajita; Pandey, Saumya; Singh, Sharda; Ghatak, Indrani.",//ezproxy.lb.polyu.edu.hk/login?url=https://www.proquest.com/scholarly-journals/gamification-learning-development-qualitative/docview/3062726349/se-2?accountid=16210,"In the dynamic volatile, uncertain, complex, ambiguous (VUCA) landscape, industries like metals and mining face a pressing challenge of skill scarcity due to the struggle to keep up with technological advancements. To revitalize their workforce and appeal to younger generations, integrating gamification into learning and development approaches holds immense potential. Employee motivation and knowledge retention can be elevated by infusing game mechanics such as badges, points, and leaderboards. Gamification fosters engagement, teamwork, and innovation through interactive experiences. This approach can effectively address the skill shortage by enhancing the industry's attractiveness and competitiveness. The paper aims to investigate the skill deficit in the metals and mining sector and explore how gamified learning methods can effectively alleviate this challenge, ultimately aiding in talent acquisition and retention. The study used purposive sampling, and data was gathered through semi-structured interviews with primary stakeholders of learning and development functions. Further, the qualitative data was subjected to thematic analysis using NVivo software. Two significant themes, from eight sub-themes that emerged from thirty codes, were identified. The first theme was issues with the young generation, and the second was the benefits of gamification in learning and development. The study suggests the need for and advantage of gamification in human resource management's learning and development function.",https://julac-hkpu.primo.exlibrisgroup.com/openurl/852JULAC_HKPU/852JULAC_HKPU:HKPU?sid=proquest&amp;auinit=Aprajita&amp;aulast=Sharma&amp;atitle=Gamification+in+Learning+and+Development%3A+A+Qualitative+Study+on+the+Indian+Mining+Sector&amp;stitle=IUP+Journal+of+Organizational+Behavior&amp;btitle=&amp;id=doi:&amp;title=Gamification+in+Learning+and+Development%3A+A+Qualitative+Study+on+the+Indian+Mining+Sector&amp;volume=23&amp;issue=2&amp;date=2024&amp;spage=51&amp;isbn=&amp;genre=article&amp;,//julac-hkpu.primo.exlibrisgroup.com/openurl/852JULAC_HKPU/852JULAC_HKPU:HKPU?sid=proquest&amp;auinit=Aprajita&amp;aulast=Sharma&amp;atitle=Gamification+in+Learning+and+Development%3A+A+Qualitative+Study+on+the+Indian+Mining+Sector&amp;stitle=IUP+Journal+of+Organizational+Behavior&amp;btitle=&amp;id=doi:&amp;title=Gamification+in+Learning+and+Development%3A+A+Qualitative+Study+on+the+Indian+Mining+Sector&amp;volume=23&amp;issue=2&amp;date=2024&amp;spage=51&amp;isbn=&amp;genre=article&amp;,"Headnote In the dynamic volatile, uncertain, complex, ambiguous (VUCA) landscape, industries like metals and mining face a pressing challenge of skill scarcity due to the struggle to keep up with technological advancements. To revitalize their workforce and appeal to younger generations, integrating gamification into learning and development approaches holds immense potential. Employee motivation and knowledge retention can be elevated by infusing game mechanics such as badges, points, and leaderboards. Gamification fosters engagement, teamwork, and innovation through interactive experiences. This approach can effectively address the skill shortage by enhancing the industry's attractiveness and competitiveness. The paper aims to investigate the skill deficit in the metals and mining sector and explore how gamified learning methods can effectively alleviate this challenge, ultimately aiding in talent acquisition and retention. The study used purposive sampling, and data was gathered through semi-structured interviews with primary stakeholders of learning and development functions. Further, the qualitative data was subjected to thematic analysis using NVivo software. Two significant themes, from eight sub-themes that emerged from thirty codes, were identified. The first theme was issues with the young generation, and the second was the benefits of gamification in learning and development. The study suggests the need for and advantage of gamification in human resource management's learning and development function.",Gamification In Learning And Development: A Qualitative Study On The Indian Mining Sector,Empty,IUP Journal of Organizational Behavior; Hyderabad,Empty,Apr-24,India,Empty,Scholarly Journal,Empty,English,Empty,Empty,Empty,Empty,Empty,Empty,Empty,Empty,Empty,Empty,3062726349,http://ezproxy.lb.polyu.edu.hk/login?url=https://www.proquest.com/scholarly-journals/gamification-learning-development-qualitative/docview/3062726349/se-2?accountid=16210,Copyright IUP Publications Apr 2024,2/17/2026,"ProQuest One Sustainability,ProQuest One Business,ProQuest One Psychology",Metals; Talent management; Mining engineering; Motivation; Work environment; Technology adoption; Training; Mining industry; Employees; Executives; Workforce; Generations; Millennials; Gamification; Games; Skills; Employee retention; Human resource management; Employee involvement; Teamwork; Corporate culture; Retention; Digital transformation,21229: Other Metal Ore Mining,Empty,Empty,Empty,Empty,Empty,23,2,Empty,IUP Publications,Empty,Empty,Empty,Journal Article,Empty,Empty,Subject: Talent management Work environment Training Mining industry Employees Executives Workforce Gamification Employee retention Human resource management Employee involvement Teamwork Corporate culture Retention Digital transformation; Industry: 21229 :‎ Other Metal Ore Mining,51-66,Hyderabad,Business And Economics--Management,Empty,Empty,Empty,Empty,Empty,Empty,Empty,Empty,India,Empty,Empty,Empty,Empty,Empty,Empty,Empty,Empty,Empty,Empty,Empty,Empty,Empty,Empty,Empty,Empty,Empty,Empty,Empty,Empty,Empty,Empty,Empty,Empty,Empty,Empty,Empty,Empty,Qualitative research; Interviews,Empty,Empty,Empty,Empty,Empty,Empty,Empty,Empty,Empty,Empty,Empty,Empty,Empty,Empty,Empty,Empty,Empty
1,"Ju, Peizhong1; Li, Chengzhang1; Liang, Yingbin1; Shroff, Ness11 Ohio State University, Columbus, Ohio, USA","Ju, Peizhong; Li, Chengzhang; Liang, Yingbin; Shroff, Ness.",//ezproxy.lb.polyu.edu.hk/login?url=https://www.proquest.com/scholarly-journals/ai-edge-nsf-institute-future-networks-distributed/docview/3090976246/se-2?accountid=16210,"This paper highlights the overall endeavors of the NSF AI Institute for Future Edge Networks and Distributed Intelligence (AI-EDGE) to create a research, education, knowledge transfer, and workforce development environment for developing technological leadership in next-generation edge networks (6G and beyond) and artificial intelligence (AI). The research objectives of AI-EDGE are twofold: ""AI for Networks"" and ""Networks for AI."" The former develops new foundational AI techniques to revolutionize technologies for next-generation edge networks, while the latter develops advanced networking techniques to enhance distributed and interconnected AI capabilities at edge devices. These research investigations are conducted across eight symbiotic thrust areas that work together to address the main challenges towards those goals. Such a synergistic approach ensures a virtuous research cycle so that advances in one area will accelerate advances in the other, thereby paving the way for a new generation of networks that are not only intelligent but also efficient, secure, self-healing, and capable of solving large-scale distributed AI challenges. This paper also outlines the institute's endeavors in education and workforce development, as well as broadening participation and enforcing collaboration.",https://julac-hkpu.primo.exlibrisgroup.com/openurl/852JULAC_HKPU/852JULAC_HKPU:HKPU?sid=proquest&amp;auinit=Peizhong&amp;aulast=Ju&amp;atitle=AI-EDGE%3A+An+NSF+AI+institute+for+future+edge+networks+and+distributed+intelligence&amp;stitle=AI+Magazine&amp;btitle=&amp;id=doi:10.1002%2Faaai.12145&amp;title=AI-EDGE%3A+An+NSF+AI+institute+for+future+edge+networks+and+distributed+intelligence&amp;volume=45&amp;issue=1&amp;date=Spring+2024&amp;spage=29&amp;isbn=&amp;genre=article&amp;,//julac-hkpu.primo.exlibrisgroup.com/openurl/852JULAC_HKPU/852JULAC_HKPU:HKPU?sid=proquest&amp;auinit=Peizhong&amp;aulast=Ju&amp;atitle=AI-EDGE%3A+An+NSF+AI+institute+for+future+edge+networks+and+distributed+intelligence&amp;stitle=AI+Magazine&amp;btitle=&amp;id=doi:10.1002%2Faaai.12145&amp;title=AI-EDGE%3A+An+NSF+AI+institute+for+future+edge+networks+and+distributed+intelligence&amp;volume=45&amp;issue=1&amp;date=Spring+2024&amp;spage=29&amp;isbn=&amp;genre=article&amp;,Headnote Abstract,Ai-Edge: An Nsf Ai Institute For Future Edge Networks And Distributed Intelligence,Empty,AI Magazine; La Canada,Empty,Spring 2024,United States,Empty,Scholarly Journal,Empty,English,Empty,Empty,Empty,Empty,Empty,Empty,https://doi.org/10.1002/aaai.12145,Empty,Empty,Empty,3090976246,http://ezproxy.lb.polyu.edu.hk/login?url=https://www.proquest.com/scholarly-journals/ai-edge-nsf-institute-future-networks-distributed/docview/3090976246/se-2?accountid=16210,"Copyright John Wiley & Sons, Inc. Spring 2024",2/16/2026,"ABI/INFORM Collection,ProQuest One Sustainability,ProQuest One Business,ProQuest One Applied & Life Sciences,SciTech Premium Collection,ProQuest One Social Sciences",Collaboration; Artificial intelligence; Success; Power; Education; Autonomous vehicles; Workforce; Knowledge management; Networks; Algorithms; Machine learning; Research; Healing; Information sharing; Leadership; Networking; Professional development,Empty,Empty,Empty,Empty,Empty,Empty,45,1,Empty,"John Wiley & Sons, Inc.",Empty,07384602,Empty,Journal Article,Empty,Empty,Subject: Artificial intelligence Workforce Machine learning,29-34,La Canada,Computers--Artificial Intelligence,23719621,Empty,Empty,Empty,Empty,Empty,Empty,Empty,Empty,Empty,Empty,Empty,Empty,Empty,Empty,Empty,Empty,Empty,Empty,Empty,Empty,Empty,Empty,Empty,Empty,Empty,Empty,Empty,Empty,Empty,Empty,Empty,Empty,Empty,Empty,Empty,"Ju, P., C. Li, Y. Liang, and N. Shroff. 2024. ""AI-EDGE: An NSF AI institute for future edge networks and distributed intelligence."" AI Magazine 45: 29-34. https://doi.org/10.1002/aaai.12145",Empty,Empty,Empty,Empty,Empty,Empty,Empty,Empty,Empty,Empty,Empty,Empty,Empty,Empty,Empty,Empty,Empty,Empty
2,"Albrychiewicz-Słocińska, Anna11 Department of Applied Sociology and Human Resource Management, Faculty of Management, Częstochowa University of Technology, Poland","Albrychiewicz-Słocińska, Anna.",//ezproxy.lb.polyu.edu.hk/login?url=https://www.proquest.com/conference-papers-proceedings/knowledge-exchange-context-remote-work-generation/docview/3159699162/se-2?accountid=16210,"The key element of knowledge management is that all knowledge, both explicit and tacit, accumulated by an organization becomes easily accessible to each of its members. This is important for decision-making processes and allows the organization to become more agile. In the literature there is an increasingly common attitude that more attention should be paid not only to the technological but also to the human aspect of knowledge management. The processes of knowledge exchange among employees have been subject to extensive research and studies, yet the recent years have added another thread to the discussion about the matter, i.e. a significant proportion of employees switching to the online work model. The aim of this article is to demonstrate how issues of knowledge exchange and learning influence preferences in choosing the form of work in the future. Based on the findings of the studies conducted on a group of employees representing Generation Z, the Principal Component Analysis (PCA) technique and was applied to organize the factors with the highest relevance for the respondents in online work. Cluster analysis was used for segmentation purposes. PCA demonstrated that the components recognized as most important were those relating to knowledge transfer and their impact on employee efficiency, and on the other hand employee relations as a factor that supports the learning processes. Cluster analysis proved that learning and knowledge exchange opinions have an impact on the form of work preferences.",https://julac-hkpu.primo.exlibrisgroup.com/openurl/852JULAC_HKPU/852JULAC_HKPU:HKPU?sid=proquest&amp;auinit=Anna&amp;aulast=Albrychiewicz-S%C5%82oci%C5%84ska&amp;atitle=Knowledge+Exchange+in+the+Context+of+Remote+Work%3A+Generation+Z+Perspective&amp;stitle=European+Conference+on+Knowledge+Management&amp;btitle=&amp;id=doi:&amp;title=Knowledge+Exchange+in+the+Context+of+Remote+Work%3A+Generation+Z+Perspective&amp;volume=&amp;issue=&amp;date=2024&amp;spage=10&amp;isbn=&amp;genre=proceeding&amp;,//julac-hkpu.primo.exlibrisgroup.com/openurl/852JULAC_HKPU/852JULAC_HKPU:HKPU?sid=proquest&amp;auinit=Anna&amp;aulast=Albrychiewicz-S%C5%82oci%C5%84ska&amp;atitle=Knowledge+Exchange+in+the+Context+of+Remote+Work%3A+Generation+Z+Perspective&amp;stitle=European+Conference+on+Knowledge+Management&amp;btitle=&amp;id=doi:&amp;title=Knowledge+Exchange+in+the+Context+of+Remote+Work%3A+Generation+Z+Perspective&amp;volume=&amp;issue=&amp;date=2024&amp;spage=10&amp;isbn=&amp;genre=proceeding&amp;,"Headnote Abstract: The key element of knowledge management is that all knowledge, both explicit and tacit, accumulated by an organization becomes easily accessible to each of its members. This is important for decision-making processes and allows the organization to become more agile. In the literature there is an increasingly common attitude that more attention should be paid not only to the technological but also to the human aspect of knowledge management. The processes of knowledge exchange among employees have been subject to extensive research and studies, yet the recent years have added another thread to the discussion about the matter, i.e. a significant proportion of employees switching to the online work model. The aim of this article is to demonstrate how issues of knowledge exchange and learning influence preferences in choosing the form of work in the future. Based on the findings of the studies conducted on a group of employees representing Generation Z, the Principal Component Analysis (PCA) technique and was applied to organize the factors with the highest relevance for the respondents in online work. Cluster analysis was used for segmentation purposes. PCA demonstrated that the components recognized as most important were those relating to knowledge transfer and their impact on employee efficiency, and on the other hand employee relations as a factor that supports the learning processes. Cluster analysis proved that learning and knowledge exchange opinions have an impact on the form of work preferences.",Knowledge Exchange In The Context Of Remote Work: Generation Z Perspective,Empty,European Conference on Knowledge Management; Kidmore End,Empty,Sep-24,United Kingdom,Empty,Conference Paper,Empty,English,Empty,Empty,Empty,Empty,Empty,Empty,Empty,Empty,Empty,Empty,3159699162,http://ezproxy.lb.polyu.edu.hk/login?url=https://www.proquest.com/conference-papers-proceedings/knowledge-exchange-context-remote-work-generation/docview/3159699162/se-2?accountid=16210,Copyright Academic Conferences International Limited Sep 2024,2/15/2026,"ABI/INFORM Collection,ProQuest One Sustainability,ProQuest One Business,ProQuest One Applied & Life Sciences,SciTech Premium Collection",Work environment; Cluster analysis; Learning; Principal components analysis; Generation Z; Communication; Tacit knowledge; Publications; Employees; Knowledge sharing; Knowledge management; Work at home; Impact analysis; Employee relations; Customization; Bioaccumulation; Knowledge representation; Knowledge economy; Efficiency,Empty,Empty,Empty,"Learning, Knowledge Exchange, Remote Work, Generation Z",Empty,Empty,Empty,Empty,Empty,Academic Conferences International Limited,Empty,20488963,Empty,Conference Proceedings,Empty,Empty,Subject: Work environment Employees Knowledge sharing Knowledge management Work at home Cluster analysis Knowledge economy,17-Oct,Kidmore End,Library And Information Sciences,20488971,Empty,Empty,Empty,Empty,Empty,Empty,Empty,Empty,Empty,Empty,Empty,Empty,Empty,Empty,Empty,Empty,Empty,Empty,Empty,Empty,Empty,Empty,Empty,Empty,Empty,Empty,Empty,Empty,Empty,Empty,Empty,Empty,Empty,Empty,Empty,Empty,Empty,Empty,Empty,Empty,Empty,Empty,Empty,Empty,Empty,Empty,Empty,Empty,Empty,Empty,Empty,Empty,Empty,Empty
